商家,区域,商圈,星级,服务,价格,销量
御轩足道会馆（清和宜康分店）,云岩区,星力银海元隆广场,5.0,单人五行强腰足道,169,10866
九松堂,云岩区,小十字,5.0,单人九松堂推拿调理套餐,79,10204
秀域科技美容（陕西店）,云岩区,喷水池,3.9,单人夏日冰点净脱,88,7222
若石连锁养生会馆,云岩区,喷水池,5.0,单人足疗（东方神韵反射域调理）,118,6179
良宸足道,云岩区,云岩广场,5.0,单人足浴套餐,78,3358
欣奕除疤（普陀店）,云岩区,六广门,4.4,去黑头：深层清洁+除粉刺+收缩毛孔+补水保湿,58,3111
克丽缇娜（普陀店）,云岩区,六广门,4.2,克丽缇娜水妍润泽单人焕美套餐,158,3092
SUNLAND SPA（欣苑连锁店）,云岩区,威清路,5.0,单人SPA套餐,188,2932
本草记,云岩区,北京路,5.0,单人汉方胚穴1次,122,2632
泰国圣荷丰胸美体美容保养馆（贵阳旗舰店）,云岩区,云岩区,5.0,单人胸部护理套餐,38,2212
妙荷轩足道,云岩区,富水北路,5.0,单人妙荷经典,148,2168
香港雅逸国际减肥美体会所（宝山北路店）,云岩区,师大,3.8,护理套餐,68,2005
香港雅逸国际减肥美体会所（文昌南路店）,云岩区,师大,3.9,护理套餐,68,2005
颐和养生馆,云岩区,喷水池,5.0,单人肩颈疏通套餐,29,1890
刘小波盲人按摩理疗（陕西路店）,云岩区,陕西路,5.0,单人盲人按摩/足疗2选1（60分钟）,50,1361
治祥尚品按摩院,云岩区,云岩区,5.0,单人尚品保健按摩（全身70分钟）,88.2,1323
大家乐专业盲人按摩,云岩区,师大,5.0,全身按摩（65分钟）,45,1201
良子足道健身,云岩区,喷水池,5.0,单人足浴套餐(加强新手法),138,1084
曼古御足,云岩区,小十字,5.0,单人曼古主题套餐,158,1015
Chang SPA泰式古法按摩,云岩区,喷水池,5.0,单人传统泰式按摩泰国技师,188,977
美人美甲美睫,云岩区,云岩区,4.0,单人樂er美甲美妆屋纯正貂毛睫毛嫁接套餐,129,176
秦姐中医理疗,云岩区,文昌北路,5.0,单人全身精油套餐,108,172
玉元堂经络通养生馆（中天花园店）,云岩区,云岩区,5.0,单人五行经络刮痧/拔罐二选一,29.9,171
悦诗风吟（小十字店）,云岩区,富水北路,3.9,满100减20元代金券,80,156
泊雅诗美容美体连锁机构,云岩区,恒峰步行街,5.0,按摩保健,38,144
海世界养生（宅吉店）,云岩区,云岩区,4.4,单人海世界养生套餐,68,137
雅妍养身美容会所,云岩区,喷水池,4.3,68元精致护理,68,127
妮彩彩妆美甲工作室,云岩区,小十字,5.0,单人彩妆套餐,18,113
立瘦专业减肥养生中心（中大店）,云岩区,中大国际购物中心,5.0,单人单次瘦肚子/瘦腰,1.8,112
丝芙丽尔SPA养身会所,云岩区,大营坡,5.0,丝芙丽尔经典标准护理（八项合一）单人套餐,36,110
V-BEAUTY 皮肤管理医美中心,云岩区,中大国际购物中心,5.0,告别黑头深层清洁套餐,99,112
巧舒盲人按摩店（花果园B南区店）,云岩区,中大国际购物中心,5.0,单人全身保健按摩,45,108
医美莱光电美肤中心（保利店）,云岩区,云岩区,4.7,【痣】淡痣一颗,10,107
秀域古方减肥（宅吉店）,云岩区,盐务街,3.9,高科技生活美容单次体验课程,129,104
秀域科技美容（花果园店）,云岩区,头桥,3.9,高科技生活美容单次体验课程,129,104
月光水影影院式足疗洗浴空间,云岩区,云岩区,4.7,单人浴资,44,102
秀域科技美容（景天城店）,云岩区,云岩区,3.9,高科技生活美容单次体验课程,129,104
安然纳米汗蒸养生馆（渔安新城店）,云岩区,未来方舟,5.0,单人面部水疗,38,100
美亿普云贵阳五行艾灸堂（友谊路店）,云岩区,友谊路,4.4,单人保健按摩套餐,39,91
缘来足疗养生馆（师大店）,云岩区,煤矿村,5.0,单人采耳/刮痧/拔罐/艾灸（4选1）,20,85
康庭推拿足道（小十字民生路店）,云岩区,小十字,4.7,单人足疗+保健+拔罐套餐,68,95
优生活养生美容连锁（保利云山店）,云岩区,市北路,5.0,单人肩颈按摩推拿+拔罐或走罐或电磁,46,84
可丽可心美体养生会所（友谊路店）,云岩区,友谊路,3.9,面部提升+48,48,76
艳颖●国际私人定制美容养生,云岩区,恒峰步行街,3.8,单人美体SPA套餐,39,75
艾莱添添美国际美容院,云岩区,恒峰步行街,5.0,肩颈疏通保养,29.8,75
重庆富侨（市北店）,云岩区,市北路,4.9,单人经典综合养生套餐,229,74
50美容养生馆,云岩区,大营坡,4.3,单人SPA面部精致护理,25.9,69
蕾特恩专业祛痘国际连锁（贵阳旗舰店）,云岩区,公园路,4.9,单人专业补水护理套餐,19,62
植美人（中大店）,云岩区,中大国际购物中心,4.0,单人植美人养生套餐,128,62
植美人SPA美体名店（中华北路店）,云岩区,云岩广场,3.8,单人植美人养生套餐,128,62
蘭若芳捨美容养生spa,云岩区,星力银海元隆广场,5.0,蘭若芳捨美容SPA单人套餐,98,57
韩蒸天下石疗养生馆（恒峰店）,云岩区,恒峰步行街,5.0,单人肩颈按摩汗蒸套餐,108,58
古宗按拿,云岩区,未来方舟,4.6,『古宗』单人古宗通经彻络气顺血活养身术（90分钟）,188,55
碧玺沙灸,云岩区,喷水池,4.3,单人碧玺沙灸+肩颈护理,168,54
杏林筋骨养护中心,云岩区,大营路,4.5,单人套餐,69,50
中大安然纳米汗蒸筋骨养护保健馆,云岩区,大营坡,5.0,单人单次筋骨养护（提供淋浴）,99.8,50
健元堂中医理疗中心,云岩区,八角岩路,4.5,艾灸调理,69.9,47
莫道盲人按摩,云岩区,飞山街,4.7,肩颈足疗单人套餐,52,47
缔美诗药妆·皮肤管理（贵山店）,云岩区,小十字,4.0,进口药妆护理油肩颈调理,68,46
悦蓉和养生馆（中大国际三分店）,云岩区,中大国际购物中心,4.5,悦蓉和身心舒缓单人体验套餐,58,47
康健盲人按摩院（瑞金北路店）,云岩区,延安西路,4.6,单人保健按摩（60分钟）,55,45
康健盲人按摩院（威清路店）,云岩区,威清路,4.5,单人保健按摩（60分钟）,55,45
尊夫人养生美容馆,云岩区,六广门,4.0,尊夫人排湿净排套餐,68,40
萱琳娜英式芳疗馆,云岩区,恒峰步行街,3.8,萱琳娜肩颈舒压套餐,98,37
瑶芳清颜专业祛痘美容中心（富水北路店）,云岩区,云岩区,4.6,单人定制细胞透析补水,68,36
锦时美容SPA会馆,云岩区,星力银海元隆广场,4.2,单人肩颈胸部护理特惠套餐,128,36
瑶芳清颜专业祛痘美容中心（合群路店）,云岩区,喷水池,4.0,单人定制细胞透析补水,68,36
汐更美养颜坊（沐水店）,云岩区,头桥,4.5,经络美胸护理套餐[复制],58,35
曲姿专业减肥,云岩区,小十字,5.0,拔罐+艾灸单人套餐,18,34
恩尚·ronas皮肤管理中心,云岩区,喷水池,4.7,【清洁精选】沃美斯清洁美容套餐,199,26
康福泰保理疗,云岩区,云岩广场,5.0,拔罐/刮痧/艾灸三选一,19.9,25
丽颖美容美体养生馆,云岩区,陕西路,4.7,单人瘦身体验3次,29.9,24
奇美伊人坊,云岩区,恒峰步行街,4.5,护理套餐,68,23
伊缘美美容美体养生（大西门店）,云岩区,恒峰步行街,5.0,单人经络刷刷瘦,128,22
枫雅子诗美容店（黔灵东路店）,云岩区,陕西路,4.7,枫雅子诗单人尊享套餐,26.8,21
施曼丽专业问题肌肤修复（贵阳店）,云岩区,喷水池,5.0,专业肩颈养护美容美体套餐,59,21
YAQING SPA,云岩区,汇金星力城,5.0,YAQING SPA单人润泽护肤,98,21
克丽缇娜云SPA,云岩区,中大国际购物中心,5.0,克丽缇娜完美女人单人护理套餐,128,19
常任盲人按摩健康中心（瑞金北路店）,云岩区,黔灵公园,4.4,单人保健1次,50,19
悦莲皮肤管理工作室,云岩区,友谊路,5.0,人参补水／巧克力美白／绿茶收毛孔软膜,88,18
润妍韩国皮肤管理,云岩区,中大国际购物中心,5.0,韩式精致修眉,1,17
黔小儿小儿推拿馆,云岩区,云岩区,4.6,单人套餐,168,17
太阳神足浴,云岩区,云岩区,4.9,养身精油,158,15
婧熙阁美甲美睫美妆社,云岩区,云岩广场,5.0,一对一精致生活妆体验,29.9,14
完美尺寸身材管理中心,云岩区,喷水池,5.0,肩颈护理,68,14
Ails化妆美甲,云岩区,恒峰步行街,4.8,化妆,58,13
立瘦专业减肥中心（市北路店）,云岩区,市北路,4.9,单人肩颈40分钟经络套餐,68,13
百年吴越专业祛痘连锁机构（盐务街店）,云岩区,盐务街,4.0,单人补水3次护理套餐,168,13
韩蒸天下石疗养生馆（中大国际店）,云岩区,中大国际购物中心,5.0,单人草本塑身调理,79.8,13
百年吴越专业祛痘连锁机构（富水店）,云岩区,小十字,4.5,单人补水3次护理套餐,168,13
女人邦皮肤管理中心,云岩区,云岩区,5.0,【精致美妆】单人精致生活妆美妆套餐,15,12
天合道重庆富侨（文昌店）,云岩区,文昌北路,4.9,单人养生套餐,218,12
纯美时光美容美体,云岩区,富水北路,3.8,纯美时光美容3选1单人体验套餐,18,12
lx轻颜无菌皮肤管理中心,云岩区,中大国际购物中心,4.6,单人维他命C美白/深层净颜补水二选一套餐,138,13
蘭芷美容美体养生会所,云岩区,大营坡,4.6,素颜女神精护套餐,99,12
鸿升足道,云岩区,北京路,5.0,单人SPA养生120分钟可过夜,238,14
Miss & Lady美容会所,云岩区,恒峰步行街,4.5,单人美丽护理套餐,68,11
康瑞盲人推拿,云岩区,云岩区,4.6,单人穴位按摩/御寒足疗二选一体验套餐,58,10
娅丹工作室,云岩区,中大国际购物中心,4.7,面部单人套餐,38,9
佐登妮丝,云岩区,云岩区,4.7,JD水润美颜,98,9
My girls 韩国美容沙龙,云岩区,云岩区,5.0,单人唇部冰点无痛脱.毛,99,9
伊熙尔•美甲美睫纹绣坊,云岩区,中大国际购物中心,5.0,单人超值套餐面部水疗,48,8
魅力形象半永久定妆机构,云岩区,中大国际购物中心,5.0,美容面部净排护理,29.4,7
An.Studio安·美甲工作室,云岩区,喷水池,5.0,单人肩颈套餐,38,7
MIA米亚美妆半永久皮肤管理机构,云岩区,喷水池,3.5,单人水气泡活氧护理（基础清洁+深层补水）,68,7
素颜美容美体工作室,云岩区,恒峰步行街,4.4,肩颈护理美容美体套餐,19.8,7
美娜私人订制美容养生会所,云岩区,云岩区,4.2,单人肩颈疏通,38,7
宜美瑄美肤纤体养生中心,云岩区,大营坡,4.9,【面部清洁】面部水气泡深层清洁,188,6
御灵雅养生馆,云岩区,红边门,4.7,中华养生套餐,198,6
集美花容（中天世纪新城店）,云岩区,云岩区,5.0,丽颜美肤护理,38,6
康美缘阳光养生,云岩区,云岩区,3.5,单人头疗（60分钟）,58,6
格林戴娜,云岩区,未来方舟,4.2,单人三焦护理套餐,38,5
魅之火皮肤光电中心,云岩区,喷水池,3.5,「六月特惠」深层清洁护肤,148,5
颜如玉美丽私人订制,云岩区,云岩区,4.3,单人韩式眼线,888,4
艾米工作室·美甲护肤半永久,云岩区,云岩广场,5.0,深层清洁专业护理,68,4
庭宇芬芳SPA,云岩区,喷水池,4.6,单人面部补水套餐,98,4
迪兰朵美容养生会所（Liya）,云岩区,小十字,4.3,单人肩颈护理+肾部保养,108,3
昕尚造型化妆美甲美睫半永久（喷水池店）,云岩区,喷水池,5.0,伴娘妆、舞台妆、年会妆,88,3
多邦形体管理美容美体机构,云岩区,喷水池,4.9,肩颈疏通/腰椎保养美体养护套餐,108,2
丽美圆SPA,云岩区,恒峰步行街,4.0,168套餐,168,2
AllforSkin健康管理,云岩区,宝山北路,3.5,单人面部基础护理,88,2
芙爾蔓の美甲半永久定妆培训机构,云岩区,友谊路,4.7,水氧透白嫩肤体验,19.9,2
月光美容SPA,云岩区,喷水池,4.3,经典七项目体验（90分钟）,8,2
克丽缇娜美容养生馆,云岩区,北京路,4.3,单人身体护理套餐,128,2
HC造型美发连锁（小十字店）,云岩区,小十字,5.0,精油开背美体护理套餐,108,1
花积木时尚生活馆,云岩区,公园路,4.6,【精致养护】单人美容精致养护套餐,68,1
莼芝媄祛痘皮肤管理中心全国连锁,云岩区,云岩区,5.0,美白淡斑去皱综合管理套餐,108,1
沐妍,云岩区,云岩区,4.6,【特色养护】沙疗养护美容美体套餐,88,1
玺莱康减肥亚健康调理机构,云岩区,贵开路,4.5,贵人养生套餐,69,1
紫莲凯娜（蟠桃宫店）,云岩区,煤矿村,4.4,单人紫莲凯娜四国风情SPA,98,1
赫拉美妆馆,云岩区,恒峰步行街,5.0,新娘美妆优惠套餐,368,0
婵淑专业减 肥总部,云岩区,公园路,5.0,补充胶原蛋白,68,0
爱妃·韩式皮肤管理·半永久,云岩区,云岩广场,5.0,韩国水气泡全脸深层清洁,158,0
慈美美业（富水北路店）,云岩区,富水北路,5.0,【女神精选】单人精致美睫睫毛套餐   下睫毛,78,0
艾洛斯美甲美睫（贵阳店）,云岩区,喷水池,5.0,新娘妆全程跟妆,598,0
v7美甲沙龙,云岩区,云岩区,5.0,草本淡斑面部保养,98,0
美丽田园,南明区,市南路,4.4,单人美白/保养/紧致/保湿SPA套餐四选一,268,13597
星福桥保健足疗（军区店）,南明区,南明区,5.0,中式养生,128,5260
姐妹足疗养生馆,南明区,花果园,5.0,单人中式按摩/足疗二选一,39.8,4639
姐妹足疗养生馆（C区2店）,南明区,花果园,4.9,单人中式按摩/足疗二选一,39.8,4639
御福康养生堂（鸿通城店）,南明区,鸿通城,5.0,单人御福通元1次,128,4381
清和宜康足道养生,南明区,花果园,5.0,单人御方足道,109,3850
克丽缇娜（丽平店）,南明区,新华路,3.9,克丽缇娜水妍润泽单人焕美套餐,158,3092
克丽缇娜（蓝波湾店）,南明区,南明区,4.0,克丽缇娜水妍润泽单人焕美套餐,158,3092
克丽缇娜（水之店）,南明区,南明区,4.0,克丽缇娜水妍润泽单人焕美套餐,158,3092
克丽缇娜（省委督导店）,南明区,南明区,3.5,克丽缇娜水妍润泽单人焕美套餐,158,3092
SUNLAND SPA（亨特连锁店）,南明区,亨特City Mall,5.0,单人SPA套餐,188,2932
SUNLAND SPA（生活馆连锁店）,南明区,南明区,5.0,单人SPA套餐,188,2932
SUNLAND SPA（逸天城连锁店）,南明区,市南路,5.0,单人SPA套餐,188,2932
琦品高端抗衰spa私享空间（花果园店）,南明区,花果园,5.0,单人护理套餐2选1,168,2760
9号公馆港派足浴足疗保健养身馆（花果园店）,南明区,花果园,5.0,【赠自助餐+水果】单人9号珍品足疗套餐,128,1613
天竺足疗养生馆,南明区,大南门,5.0,单人全身按摩套餐,149,1595
足鑫堂盲人推拿城,南明区,花果园,5.0,全身放松按摩套餐,49.9,1451
御福康足浴保健养生会所（花果园店）,南明区,南明区,5.0,【口碑热销】单人宫廷乐足套餐,128,1228
盛泰足道推拿会馆,南明区,花果园,5.0,单人养身足疗/全身按摩2选1,58,1140
重庆富侨（鸿通城店）,南明区,鸿通城,5.0,单人中华养生套餐,238,1117
宏兰美业SPA连锁机构,南明区,花果园,5.0,单人宏兰女宾超值套餐,88,944
柔婷（新华店）,南明区,新华路,3.5,单人美容专业护理套餐1次,38,908
柔婷（鑫源店）,南明区,大十字,3.5,单人美容专业护理套餐1次,38,908
柔婷（博爱路店）,南明区,博爱路,3.5,单人美容专业护理套餐1次,38,908
燕子盲人按摩店（花果园r区店）,南明区,花果园,5.0,单人全身推拿（60分钟）,50,893
益康盲人按摩,南明区,甲秀楼,5.0,单人全身对症按摩,52.8,880
美研坊美容养生足疗会所（花果园购物中心店）,南明区,花果园,5.0,单人精油刮痧拔罐艾灸,49,809
星福桥·足疗保健（文化路店）,南明区,河滨公园,5.0,单人中式养生,128,765
金兴盲人按摩中心,南明区,南明区,5.0,按摩/足疗2选1,45,719
足之韵,南明区,鸿通城,5.0,单人足之道套餐,58,635
重庆家贵富侨,南明区,花果园,4.4,单人重庆富侨中华养身（赠送简餐一份）,208,580
古氏中医足疗（一期店总店）,南明区,花果园,5.0,单人超值套餐（45分钟）,38,554
古氏中医足疗（C区三分店）,南明区,花果园,5.0,单人超值套餐（45分钟）,38,554
本色美甲美睫化妆店,南明区,花果园,5.0,生活妆/裸妆2选1,19.9,497
布道中医理疗,南明区,花果园,5.0,单人刮痧拔罐2选1,30,476
黄海涛盲人按摩,南明区,花果园,5.0,颈椎腰椎 全身关节 软组织扭伤适应症按摩,68,474
奕彩筋骨堂中医养生馆（亨特国际店）,南明区,亨特City Mall,5.0,刮痧、拔罐、艾灸,50,443
锦上女性形象设计工作室,南明区,亨特City Mall,5.0,韩式精致化妆套餐,68,430
足之缘养生馆（花果园1期店）,南明区,花果园,5.0,单人白天场中式按摩,58,429
足之缘养生馆（花果园v区店）,南明区,花果园,4.5,单人白天场中式按摩,58,429
福莲花养生馆,南明区,南明区,5.0,单人福莲养足套餐,98,408
吉康盲人推拿按摩中心,南明区,南明区,4.9,单人按摩/足疗2选1体验,46,405
YU SPA（亨特店）,南明区,亨特City Mall,5.0,夏季面部护理+背部舒缓SPA套餐,138,397
新华路翠微巷盲人按摩,南明区,新华路,5.0,单人全身按摩,50,391
新禾,南明区,遵义路,4.5,古玄堂美白补水单人套餐,29.8,390
摩指印象（贵阳店）,南明区,遵义路,4.9,单人印象足浴,148,386
轻松盲人按摩院（河滨公园总店）,南明区,河滨公园,5.0,单人按摩调理套餐,55.8,379
大嘴鱼·风情鱼疗馆,南明区,南明区,5.0,单人泰式鱼疗,23,372
刘美彤理疗馆,南明区,花果园,4.8,单人全身保健按摩,68,369
子亲康乐妇幼推拿,南明区,南明区,5.0,单人小儿推拿+热敷包,95,334
重庆富侨（花果园店）,南明区,南明区,4.6,单人精油推拿套餐,238,310
飞锐美业合心生活馆（金熙府店）,南明区,南明区,5.0,单人身体精油按摩套餐,168,294
飞锐美业合心生活馆（军区店）,南明区,鸿通城,5.0,单人身体精油按摩套餐,168,294
伊人坊养生馆,南明区,花果园,5.0,单人全身体验套餐,29.9,262
养生医馆-美容美体,南明区,花果园,5.0,单人头疗套餐1次,88,261
徐氏康复养生中心,南明区,花果园,5.0,徐氏烧药+弩药元宝灸+徐氏推拿三合一套餐,38,252
铂美美容健康生活馆（花果园C区店）,南明区,花果园,4.6,单人SPA健康体验,68,246
铂美美容健康生活馆（花果园v区店）,南明区,花果园,4.6,单人SPA健康体验,68,246
盛权足疗（V区店）,南明区,花果园,5.0,单人超值套餐,78,228
丽媛足疗养生馆（花果园金融街店）,南明区,花果园,5.0,单人全身按摩（60分钟）,68,222
魅颜悦色国际皮肤管理连锁机构（贵阳店）,南明区,花果园,4.5,单人vip深层面部护理套餐,29.9,220
社区富侨足疗店,南明区,花果园,5.0,单人拔火罐/刮痧2选1,16.8,212
维雅风尚旗舰店,南明区,遵义路,5.0,单人拔罐祛湿气1次,1.8,209
苗家康美养生减肥中心,南明区,花果园,4.7,单人肩颈疏通套餐,98,206
Dermagram瑞士活肤美妍馆,南明区,市南路,4.9,法国香薰精油肩颈护理单人套餐,38,195
国膳养生阁·足根堂总店（都司路店）,南明区,南明区,5.0,中华足腿前臂反射平衡按摩,118,194
爱康盲人按摩,南明区,花果园,4.9,全身推拿,48,190
玛丽艳美容养生连锁（花果园店）,南明区,花果园,5.0,玛丽艳按摩套餐,38,189
渝美人,南明区,花果园,4.7,面部精致SPA护理,39,189
汤泉御足养生会所（花果园购物中心店）,南明区,花果园购物中心,5.0,单人全身按摩+足疗,139,187
砭术养生会馆（花果园店）,南明区,花果园,4.7,单人砭术按摩体验劵,1,188
金品苗方专业祛痘全国连锁机构（贵阳店）,南明区,花果园,5.0,单人金品苗方黑头套餐,16,187
极致私佳美场美甲美睫美容养生,南明区,花果园,5.0,清洁水氧去黑头补水收毛孔,38,186
蔓雅婧美容养生馆,南明区,花果园,4.7,蔓雅婧美容护理套餐 西湖路,28,182
欧洁蔓年轻态抗衰中心,南明区,花果园,5.0,单人面部补水美容套餐,48.8,176
林都玉指保健养生会所,南明区,花果园,4.5,单人中级保健（60分钟）,89,168
老杨盲人推拿按摩,南明区,花果园,5.0,单人全身按摩1小时,48,163
理疗康复中心,南明区,花果园,4.9,单人五行拔罐/刮痧2选1,15,156
慕妍美容美体养生SPA馆,南明区,大十字,4.0,48套餐,48,97
漾·皮肤管理中心,南明区,南明区,5.0,专业皮肤检测单人体验套餐,1,96
玫瑰伊人美容养生馆,南明区,花果园,5.0,玫瑰伊人美容养生馆超值美容单人套卡,68,96
永泉盲人推拿足疗,南明区,护国路,5.0,单人全身保健按摩/足浴+保健二选一,48,92
千足堂足疗养生会所,南明区,花果园,5.0,单人中式按摩或精油足疗,38,88
特轻松盲人按摩院（花果园Q区店）,南明区,南明区,4.9,单人全身按摩套餐,50,90
特轻松盲人按摩院（花果园大街店）,南明区,花果园,4.9,单人全身按摩套餐,50,90
美丽加分美容美甲机构,南明区,花果园,5.0,面部SPA,9.9,90
御花园养生足疗会馆（花果园店）,南明区,花果园,5.0,【开业特惠】单人-宫廷养生足疗+足部按摩,68,86
汐更美美容养生连锁（沐阳店）,南明区,亨特City Mall,4.4,单人汐-面部防晒护理,68,84
汐更美美容养生连锁（沐云店）,南明区,南明区,4.5,单人汐-面部防晒护理,68,84
湘遇美体spa养生中心（贵阳店）,南明区,南明区,4.5,单人高端服务SPA服务套餐（可上门）,298,83
花蕾韩式半永久工作室,南明区,花果园,5.0,西班牙进口迪芭妮蜜蜡修眉单人套餐,48,82
Green Health 青奢●美容养身（花果园店）,南明区,花果园,5.0,修眉/艾灸/拔罐/泥灸单人体验男/女护理项目3选1,9.9,82
雅琳美容美体养生馆,南明区,花果园,5.0,雅琳肩颈、面部精致SPA护理,49.9,80
瀚丽养生会所（花果园购物中心店）,南明区,花果园,4.9,单人古方保健初级头疗套餐,48,79
可丽可心美体养生会所,南明区,新华路,3.8,面部提升+48,48,76
尚足轩足浴保健养生酒店（花果园店）,南明区,花果园,5.0,单人尚体泰式,258,76
尚足馆足疗养生,南明区,花果园,4.8,全天场单人中式保健,58,74
美诗雅美容美体养生馆,南明区,大十字,5.0,身心经络放松体验套餐,19.8,71
唯美美容养生馆,南明区,花果园,4.6,身体护理单人套餐,38.8,67
琉璃时光私人美容养生会所,南明区,沙冲南路,5.0,女士单人豪华SPA5次套餐,138,63
蕾特恩专业祛痘国际连锁（花果园店）,南明区,花果园,5.0,单人专业补水护理套餐,19,62
温馨足疗保健养生馆（花果园购物中心店）,南明区,花果园,5.0,【新春特惠】单人道式足浴（60分钟）,69,61
蓝轩苗方熏蒸SPA养生（亨特店）,南明区,南明区,5.0,单人肩颈调理,68,61
博迦梵康国际连锁养生会所（钻石广场店）,南明区,南明区,5.0,【周年庆-5折大促】单人宫廷五行经络养护SPA,194,59
古生堂中医养生,南明区,都司路,5.0,经络拔罐或本草泡脚2选1,9.9,60
静莎彩妆美甲美睫半永久,南明区,花果园,4.9,肩颈保养    精油开背   卵巢保养 背部刮痧,38,57
静莎美容养生馆（花果园C区家电广场店）,南明区,花果园,5.0,肩颈保养    精油开背   卵巢保养 背部刮痧,38,57
舒身足道,南明区,花果园,3.7,单人鸿运脊疗,140,55
碧玺沙灸养生馆（花果园店）,南明区,南明区,4.9,单人沙灸1次十面部芦荟水疗,108,55
XIXIGRACE西西格美妆.半永久高端定制,南明区,花果园,5.0,「西西格定制」精致生活妆,29.9,55
Queenhoo贵阳皮肤管理中心,南明区,花果园,5.0,面部深层清洁套餐,99,49
秀妍生活馆,南明区,亨特City Mall,5.0,单人AQVA Peel小气泡毛孔清洁,168,51
英涛祛斑祛痘研究所（花果园店）,南明区,花果园,5.0,单人痘肌护理体验1次,9.8,47
缔美诗药妆科技美肤（醒狮店）,南明区,大十字,3.5,进口药妆护理油肩颈调理,68,46
缔美诗药妆科技美肤（中天广场店）,南明区,都司路,4.0,进口药妆护理油肩颈调理,68,46
薇美焕颜美容,南明区,花果园,5.0,【面部养护】单人面部去黑头补水养护套餐,37,45
安然纳米汗蒸养生馆（花果园m区店）,南明区,南明区,5.0,单人汗蒸+肩颈按摩,48,44
爱唯一五谷果蔬芦荟美颜馆,南明区,花果园,5.0,单人芦荟鲜汁面膜,9.9,42
爱丽尔美容养生馆,南明区,南明区,5.0,单人品牌精致面部护理/单人肩颈舒缓放松+刮痧（二选一）,58,42
亿家康保健足疗,南明区,南明区,4.9,单人精油养生,158,42
圆梦美容美体养生,南明区,鸿通城,3.6,单人OPT脱腋毛套餐,99,41
圣壕男士spa养生馆,南明区,南明区,4.2,单人SPA,468,40
嫁妆美甲化妆美睫,南明区,遵义路,5.0,精致明星妆,59.8,40
艾莱莉莎美容养生馆,南明区,大十字,5.0,肩颈疏通保养套餐,15.8,39
科颜堂皮肤健康管理中心,南明区,花果园,5.0,水氧痘肌护理美容套餐,18,38
瑶芳清颜专业祛痘祛斑美容中心（花果园店）,南明区,花果园,5.0,单人定制细胞透析补水,68,36
维斯卡时尚美学概念馆,南明区,甲秀楼,5.0,【美容养颜】360深层补水套餐,48,36
美时慕（能辉店）,南明区,南明区,5.0,单人面部+身体,158,35
重庆富侨（亨特店）,南明区,亨特City Mall,5.0,单人富侨精油推拿,228,34
贵阳艾美圆纹绣,南明区,市南路,4.0,韩式美·瞳线单人套餐,698,33
菩籣缇亚spa,南明区,花果园,4.7,双人身体按摩套餐,558,32
御足豪庭足疗保健养生馆（花果园T区店）,南明区,花果园,5.0,单人御足十二经络养生（送收费茶水）,238,31
汗蒸天下（花果园一期店）,南明区,花果园,5.0,单人香薰精油（美背、美白、刮痧）+汗蒸,79,31
