商家,区域,商圈,星级,服务,价格,销量
蜜蜜mimi日式美甲美睫专门店,香坊区,安埠商厦/果园街,4.5,单人日式美妆+眉型设计,980,0
颐美科学美容,阿城区,阿城区,4.1,单人肩颈疏通养生1次,39,0
娇莉芙（江北万达店）,松北区,世茂大道,5.0,单人绿鱼子面部抗氧+全身通络护理套餐,208,2431
乾恒保健休闲会馆,松北区,世茂大道,5.0,单人乾恒中式保健1次,130,945
满益乐活养生堂,松北区,世茂大道,5.0,单人体位调理酸痛舒缓1次,38,414
重庆富侨足道,松北区,松北区,3.0,单人90分钟足浴套餐预售,70.8,26
茗源养生馆,松北区,松北区,4.5,单人全身经络疏通,128,20
鸿颜意美养生会馆,松北区,松北区,4.9,单人美肤护理美容养生套餐,29.9,18
蓝依坊美容美体,松北区,世茂大道,5.0,单人美丽容颜八项合一,98,16
米蘭造型美发连锁机构（总店）,松北区,松北区,5.0,美容美体四选三套餐,19.9,5
敖麓谷雅·水疗健身中心,松北区,冰雪大世界,4.0,四国spa护理,398,5
Lynn韩式半永久纹绣美甲汇,松北区,世茂大道,4.3,单人韩式修眉+设计眉型,1,4
闫红美容养生会馆,松北区,世茂大道,3.5,单人护理身体项目,99,2
甲美人美甲美睫半永久,松北区,松北区,5.0,清新刺青,98,2
本草女人香美容会馆,松北区,世茂大道,3.5,单人美容护理套餐,28.8,0
