商家,区域,商圈,星级,服务,价格,销量
御景汇健康会所,晋安区,五四北,5.0,单人特惠足疗按摩+精油开背套餐,155,81
RoSa洛莎美肤中心,晋安区,东二环泰禾广场,5.0,单人洛莎Triple Peeling肌底微晶焕肤套餐,198,76
悦girls皮肤管理中心,晋安区,东二环泰禾广场,5.0,单人小气泡皮肤深层清洁套餐,76,71
瑶芳专业祛痘（泰禾店）,晋安区,五四北,5.0,单人黑头清洁,19.8,71
爱儿乐婴童SPA水育乐园（东二环泰禾店）,晋安区,东二环泰禾广场,4.9,单人婴童游泳（中大池）,56,70
管氏金水桶休闲会所（长乐北路店）,晋安区,世欧王庄,4.2,单人养生足浴,125,72
小余头盲人中医推拿,晋安区,岳峰镇,3.8,推拿按摩套餐,45,66
百都会养生会所,晋安区,岳峰镇,4.2,单人韩式优指,209,64
纤美美体汗蒸养生馆,晋安区,东区/鼓山,4.9,单人汗蒸,23.8,61
九九红休闲养生会所,晋安区,紫阳/象园,4.0,单人精油开背套餐,169,59
小邓盲人推拿,晋安区,五里亭,4.8,单人刮痧拔罐套餐,48,56
窈窕淑女（双美店）,晋安区,岳峰镇,4.1,单人窈窕肩颈1次,139,53
窈窕淑女涣美纹绣店,晋安区,五四北,4.0,单人窈窕肩颈1次,139,53
爱美化妆品（福新店）,晋安区,福新路,3.5,妆容设计套餐,9.9,50
索菲毛囊皮肤管理会所,晋安区,东二环泰禾广场,5.0,小气泡清洁单次,98,26
love尚彩妆纹绣,晋安区,世欧王庄,5.0,单人化妆3选1,28,25
纤柔美容美体会所,晋安区,世欧王庄,4.6,单人背部精油调理套餐,128,23
榕城嘉人spa馆,晋安区,岳峰镇,4.1,单人乳房护理疏通套餐,98,22
金丽康术养理疗中心,晋安区,福新路,4.1,五行脊椎调理套餐,69,20
古熙美容美体养生SPA会所,晋安区,五里亭,5.0,单人全息经络玉石减法美容,38,20
A素颜韩国皮肤管理中心,晋安区,世欧王庄,5.0,单人气泡深层清洁,98,18
添姿养生减肥终点站,晋安区,华林路/茶园,5.0,单人背部调理塑型拔罐套餐,166,18
中威能量汗蒸养生馆,晋安区,福新路,5.0,单人拔罐/刮痧2选1,19.8,18
黛丝·DearS裸妆美体私人订制,晋安区,世欧王庄,4.4,单人2次面部微雕精选套餐,88,17
福道经络养生美容美体,晋安区,世欧王庄,4.6,精油开背,98,17
LE CYGNE天鹅童话（东二环泰禾店）,晋安区,东二环泰禾广场,3.5,面部补水亮肤护理+身体舒缓护理综合精选套餐,128,16
纤雅美容养生会所,晋安区,东区/鼓山,4.5,单人5S面部嫩肤水疗套餐,58,15
九九养生（火车北站店）,晋安区,火车站,3.7,单人九九推拿,139,15
"弦鱼半永久定妆,美甲私人定制",晋安区,晋安区,5.0,单人眉型设计,1,15
梦俪形象管理,晋安区,世欧王庄,5.0,单人韩国微雕祛黑头套餐,88,15
小麟美容养生工作室,晋安区,金鸡山公园,4.9,拔罐体验1次,25,15
玫瑰之约女子生活馆,晋安区,紫阳/象园,4.0,玫瑰之约面部冰疗套餐,29,14
佰妙能量养生会所,晋安区,五四北,4.9,背部／肠胃／胸部／肩颈保养4选2,99,14
阳光美界养生/spa,晋安区,东二环泰禾广场,4.5,单人面部深层补水扫螨面护套餐,98,14
喜源纤体管理中心,晋安区,五四北,4.2,单人喜源速造V字脸体验套餐,88,13
伊媚尔美颜美体,晋安区,东二环泰禾广场,5.0,单人三线淋巴净排套餐,118,13
康逸盲人推拿店,晋安区,华林路/茶园,3.5,推拿/足浴2选1套餐,50,12
UN体能康复工作室（世欧店）,晋安区,世欧王庄,4.0,单人腰颈肩护理课程,98,12
甄美美容美体纹绣美甲,晋安区,世欧王庄,5.0,单人3E补水护理＋背部经络疏通,88,12
漫影美妆皮肤管理中心,晋安区,东二环泰禾广场,5.0,小气泡深层清洁套餐,68,11
菲安珂.轻医美皮肤管理中心,晋安区,建材市场/茶会,4.6,单人润肌活氧深度水疗补水套餐,118,11
纤美Spa工作室,晋安区,世欧王庄,4.7,单人专业肩颈疏通,48.8,11
明日之鑫,晋安区,五四北,4.0,单人开背套餐,88,10
F.Z海伦纹绣韩式半永久纹眉眼唇,晋安区,晋安区,5.0,单人新娘出门妆一次,168,10
济方养生理疗馆,晋安区,东区/鼓山,4.2,单人瘦身套餐,29,10
z&y;私人订制,晋安区,晋安区,4.4,单人面部护理,38,9
依甸霖中韩半永久眉眼唇培训机构,晋安区,东二环泰禾广场,5.0,单人眼线体验套餐,188,9
梦莎美妆,晋安区,晋安区,4.3,单人眉形设计,3,9
大美人纹绣韩式半永久工作室,晋安区,晋安区,4.5,无痛穿耳,1,8
爱丽丝美颜工作室,晋安区,五四北,4.5,单人单次温和净某部位毛体验套餐,39,8
尚美私人订制,晋安区,金鸡山公园,4.7,单人日常生活妆套餐,29,7
爱在这里养生会所（钱隆首府店）,晋安区,世欧王庄,4.8,三伏灸套餐,88,7
齐馨盲人推拿,晋安区,晋安区,4.1,单人足浴/推拿2选1+刮痧+拔罐套餐,80,7
爱·瑜伽生活馆,晋安区,岳峰镇,4.1,单人速造V字脸体验套餐,38,5
莎菲琳名媛美容会所,晋安区,五四北,4.6,养生汗蒸套系,138,5
中医美容美体养生,晋安区,岳峰镇,3.8,单人艾灸养身1次,38,5
月密达私人定制韩式半永久,晋安区,东二环泰禾广场,5.0,单人美容形象指导套餐,28,4
ame'爱美（家乐福店）,晋安区,福新路,4.9,生活妆单次,5,4
慕名美容美甲纹绣,晋安区,东区/鼓山,4.3,单人美容超值体验套餐,118,4
金帝商务酒店休闲中心,晋安区,金鸡山公园,3.8,单人足按/中式推拿/擦背3选1,48,4
花皇美容中心,晋安区,省图书馆/温泉路,3.5,单人超值美容套餐,68,4
尼欧美甲半永久定妆,晋安区,东二环泰禾广场,3.0,单人貂绒毛美睫一次,268,3
美雅护肤美甲半永久,晋安区,东二环泰禾广场,5.0,净肤去螨护肤,98,3
Anny纹绣美甲美睫,晋安区,晋安区,4.6,单人刮痧/拔罐二选一,18,3
栢荷婚尚造型,晋安区,世欧王庄,4.0,单人盘发,28,1
B&Y;高级私人形象管理,晋安区,世欧王庄,3.5,皮肤管理一次,128,1
STYLE美甲（鹤林店）,晋安区,晋安区,5.0,单人蓝宝石嫩肤,388,0
JL新加坡国际半永久美业会所,晋安区,建材市场/茶会,4.6,单人皮肤深层补水＋耳烛淋巴护理,68,0
寇氏瘦身养生馆（金辉东景店）,晋安区,东区/鼓山,4.0,寇氏养生馆养生纤体套餐,69,0
贝颜美容连锁中心（晋安店）,晋安区,建材市场/茶会,3.5,单人单次基础清洁加MTS护理,98,0
紫花国际瘦身连锁,晋安区,晋安区,4.4,单人拔罐,28,0
如梦专业修脚房（岳前店）,晋安区,岳峰镇,3.5,中式精油按脚套餐,39.9,0
小蚊子形象管理,晋安区,五四北,4.7,单人美肤超值套餐,689,0
申由名媛美甲纹绣美容店,晋安区,五四北,5.0,单人MTS皮肤管理,380,0
世龙世家手足健康护理连锁（仓山区卢滨路店）,仓山区,榕城广场/金山公交站,4.4,泡脚足浴+修脚护理单人套餐,9.9,26906
大拇哥CEO,仓山区,白湖亭,5.0,单人中式推拿,98,6336
康之源养生馆,仓山区,榕城广场/金山公交站,5.0,单人足浴推拿2选1,125,4031
大拇哥保健家园（戴斯店）,仓山区,学生街,5.0,单人中式推拿,98,2564
清颜堂专业祛痘连锁机构（仓山万达店）,仓山区,仓山万达广场,5.0,单人健康清痘护理2次体验套餐,10,2419
指中道|专业理疗馆（万达理疗店）,仓山区,仓山万达广场,5.0,单人颈肩腰背推拿套餐,113,1941
海之澜,仓山区,榕城广场/金山公交站,4.4,单人足浴/推拿2选1,68,993
优颖专业脱毛美容会所（点金财富中心店）,仓山区,红星爱琴海广场,5.0,单人腋下净毛包干套餐,88,770
天悦会温泉SPA,仓山区,榕城广场/金山公交站,4.8,单人套餐,228,675
蕾特恩专业祛痘国际连锁（师大店）,仓山区,学生街,5.0,面部祛痘特惠护理单人套餐,1,630
悠境主题养生馆Um SPA,仓山区,红星爱琴海广场,5.0,观影足疗套餐,138,476
金手指,仓山区,红坊海峡创意产业园,4.8,单人足按/推拿2选1,58,425
可诺丹婷美容院（仓山万达店）,仓山区,仓山万达广场,3.6,可诺丹婷美颜美体连锁特惠丽人套餐,38,390
月密达纹绣韩式半永久（仓山万达店）,仓山区,仓山万达广场,5.0,美容形象指导套餐,28,252
玉石理疗馆,仓山区,福湾新城/湾边,5.0,5人汗蒸,120,239
荷伊思（金山万达店）,仓山区,仓山万达广场,4.0,单人中式养生套餐,43,231
巴厘传奇（仓山万达）,仓山区,仓山万达广场,4.1,健康美容单人套餐,113,217
富侨休闲会所,仓山区,学生街,4.6,单人古典足浴/中式推拿2选1,108,214
和心道推拿,仓山区,仓山万达广场,5.0,单人推拿/足浴2选1,59,209
仓山万达瑶芳专业祛痘祛斑（福州总店）,仓山区,仓山万达广场,5.0,单人净面补水美白/祛黑头2选1体验3次,66,201
谷中百合美容美体spa会所,仓山区,仓山万达广场,4.8,谷中百合美容美体SPA会所护理套餐,29.9,197
SEVENAIL美甲美睫SPA,仓山区,红星爱琴海广场,5.0,美甲单人套餐,58,189
三元堂中医工作室,仓山区,建新镇,5.0,单人推拿+拔罐+刮痧套餐,88,188
玉玄宫养生馆,仓山区,金山公园/建新路,5.0,单人头疗+面部,58,167
享足人生,仓山区,金山工业区福湾片,4.2,足浴/推拿,78,166
水都名媛（江南水都店）,仓山区,江南水都,3.9,单人水都拔火罐1次,9.9,165
上善美名媛美修堂,仓山区,榕城广场/金山公交站,3.6,单人水都拔火罐1次,9.9,165
美丽人生生活馆,仓山区,金山大润发,5.0,美容美体套餐一份,38,163
缘份阁休闲馆,仓山区,金山公园/建新路,3.8,单人全身舒筋套餐,138,157
可诺丹婷美容院（百万店）,仓山区,仓山万达广场,3.0,新丽人单人套餐,58,156
汗蒸秀韵纤体瘦身会所,仓山区,仓山万达广场,5.0,单人汗蒸+肩颈舒通,108,139
悦儿湾婴幼儿游泳馆（洪山桥水岸名居店）,仓山区,建新镇,4.6,单人婴童游泳体验价,39,132
Joy Skin皮肤管理中心（乔伊·美学）,仓山区,红星爱琴海广场,5.0,单人水氧深层护肤（补水/美白/舒敏/去黄/缓衰5选1）,268,122
VIVE SPA 唯肤荟,仓山区,盖山,5.0,舒适地带舒缓减压全身SPA单人套餐,298,121
郑远元专业修脚房（洪湾北路店）,仓山区,建新镇,4.6,郑远元单人舒克脚腾片,50,119
郑远元专业修脚房（学生街店）,仓山区,学生街,4.5,郑远元单人舒克脚腾片,50,119
郑远元专业修脚连锁（上雁店）,仓山区,金山公园/建新路,4.5,郑远元单人舒克脚腾片,50,119
郑远元专业修脚房（大坪路店）,仓山区,三叉街,4.0,郑远元单人舒克脚腾片,50,119
郑远元专业修脚连锁（洪山桥店）,仓山区,建新镇,3.8,郑远元单人舒克脚腾片,50,119
郑远元修脚（桔园店）,仓山区,金山公园/建新路,4.0,郑远元单人舒克脚腾片,50,119
郑远元专业修脚房（金山万达店）,仓山区,金山浦上工业区,3.9,郑远元单人舒克脚腾片,50,119
郑远元修脚（金港路店）,仓山区,仓山万达广场,3.7,郑远元单人舒克脚腾片,50,119
郑远元专业修脚房（公交总站店）,仓山区,榕城广场/金山公交站,4.2,郑远元单人舒克脚腾片,50,119
郑远元专业修脚房（高宅路店）,仓山区,金山浦上工业区,4.0,郑远元单人舒克脚腾片,50,119
郑远元专业修脚（上渡店）,仓山区,上渡建材,4.4,郑远元单人舒克脚腾片,50,119
郑远元专业修脚房（金榕北路店）,仓山区,金山大润发,4.6,郑远元单人舒克脚腾片,50,119
云山中医保健推拿,仓山区,建新镇,4.0,云山盲人推拿,55,115
纤美瘦身堂,仓山区,榕城广场/金山公交站,5.0,单人专业肩颈疏通,38,110
西班牙养生会所（仓山万达店）,仓山区,仓山万达广场,4.8,美容套单人餐,68,109
秀域科技美容（美域店）,仓山区,江南水都,4.0,高科技生活美容单次体验课程,129,103
秀域科技美容（汇达店）,仓山区,三叉街,4.0,高科技生活美容单次体验课程,129,103
秀域科技美容（金汇豪庭店）,仓山区,榕城广场/金山公交站,4.0,高科技生活美容单次体验课程,129,103
小资休闲养生馆,仓山区,仓山万达广场,5.0,全身经络指压,118,93
花想容养生美颜馆（仓山万达店）,仓山区,仓山万达广场,5.0,单人面部深层补水护理,48,86
伊莱美芙美容会所（中天金海岸店）,仓山区,金山公园/建新路,4.0,福州伊莱美芙美容会所美容单人套餐,78,84
蝶变佳人美容店,仓山区,三叉街,4.8,面部精致护理及精油开背单人套餐,58,74
窈窕美人纤体中心,仓山区,仓山万达广场,5.0,单人养生罐体验一次,28,73
素悦sure,仓山区,金山公园/建新路,5.0,单人美容养生综合套餐（洗脸2次+汗蒸2次+精油开背1次）,98,13
艾黎蔻·美甲美妆生活馆,仓山区,红星爱琴海广场,5.0,单人点·痣,9.9,13
东方佳人（金山万达店）,仓山区,金山浦上工业区,5.0,肩颈护理2次+太极神灸2次,58,13
Queen美容工作室,仓山区,仓山万达广场,4.0,单人水娃娃精致护理套餐,38,12
福韵康体养颜会所（友兰店）,仓山区,榕城广场/金山公交站,3.9,养生单人套餐,78,11
珈蔓柏纹眉绣眉纹绣韩式半永久（仓山万达店）,仓山区,仓山万达广场,5.0,美白嫩肤净斑去黑头,398,10
韩式速美生活馆,仓山区,红星爱琴海广场,4.6,单人身体毒素湿气净排汗蒸养生护理2次套餐,88,10
百花养生堂,仓山区,仓山万达广场,4.3,单人中式传统推拿套餐,89,10
恩赐佳缘养生会所,仓山区,学生街,4.2,单人面部/背部护理,78,9
荟可暄美容美甲纹绣,仓山区,江南水都,3.9,魔法芭比烫睫毛单人套餐,39,9
蕾特恩专业祛痘国际连锁（仓山万达店）,仓山区,红星爱琴海广场,4.9,单人蕾特恩DNA靶向黑头析出套餐,19.8,9
金粉俪人光电咖美肤中心（仓山店）,仓山区,仓山万达广场,4.0,单人金粉瑜伽传奇套餐,58,9
俪人堂减肥美容养生会所,仓山区,金山公园/建新路,4.9,单人面部微雕,99,9
倾城韩式半永久私人订制中心,仓山区,仓山万达广场,4.5,单人单次净唇毛/腋毛体验套餐2选1,36,8
美丽名媛美容养生会所（世欧上江城店）,仓山区,盖山,3.5,DAMASTER身体护理卡,128,7
美丽名媛美容养生会所（金山中天金海岸店）,仓山区,金山公园/建新路,3.5,DAMASTER身体护理卡,128,7
艾元堂,仓山区,仓山万达广场,3.5,单人艾灸体验2次,59.8,7
奕格美容,仓山区,金山大润发,4.9,单人水氧360°深层清洁补水特惠套餐,58,7
思美人美容化妆美甲,仓山区,仓山万达广场,5.0,单人美容套餐,88.8,7
天贝医美皮肤管理中心,仓山区,金山大润发,4.6,汗蒸+面部补水保湿SPA,78,2
芳香丽人spa养生会所,仓山区,榕城广场/金山公交站,4.5,烫睫毛,68,1
vivi韩式速美生活馆,仓山区,仓山万达广场,4.9,单人韩式清透无感妆套餐,69,1
可可私人定制学生街店,仓山区,学生街,5.0,单人精致生活妆套餐,39.9,1
小柠檬美甲,仓山区,仓山万达广场,5.0,单人化妆一次,59.9,1
鹿見花园,仓山区,仓山万达广场,4.0,单人面部美容护肤套餐,99,1
享瘦纤体生活馆（仓山万达店）,仓山区,乐都汇,3.8,大肠水疗美颜体验套餐,30,1
梦娜美妆工作室（金山万达店）,仓山区,仓山万达广场,4.4,代金券,30,1
纤慕美甲纹绣店（上三路店）,仓山区,仓山区,4.3,单人手部护理,25,1
惠美康,仓山区,建新镇,3.5,单人推拿,36,0
星颜韩式半永久,仓山区,仓山万达广场,5.0,单人面部提拉紧致,88,0
Hinyo韩妆馆韩式半永久眉眼私颜定制,仓山区,红星爱琴海广场,3.5,双十二单人韩国奢华黄金护理,88,0
新浪潮养生美容会所,仓山区,金山大润发,3.5,经典泡浴,68,0
康和堂中医馆（三盛巴厘岛店）,仓山区,三叉街,3.5,推拿/足疗2选1,70,0
Sunny Gem 素瑾韩式半永久皮肤管理,仓山区,仓山万达广场,3.5,韩式清洁补水,168,0
红颜香妃美容美体,仓山区,仓山万达广场,4.5,净排排酸调理礼包,99,0
美施美甲美睫皮肤管理工作室,仓山区,仓山万达广场,4.2,面部提升套餐,199,0
诚城足浴,仓山区,金山公园/建新路,4.6,单人老瑶汤+足底走罐,48.9,0
伊琳娜美容美体,仓山区,金山浦上工业区,3.9,面部水养疗单人套餐,38,0
靓帝细胞美疗,仓山区,仓山万达广场,4.0,单人养巢原液胸部护理,298,0
寇氏减肥（福州分公司）,仓山区,榕城广场/金山公交站,3.5,寇氏养生馆养生纤体套餐,69,0
尚悦至尊养生会所,仓山区,建新镇,4.1,单人皇庭纯式养生,398,0
苏三说美甲美睫纹绣,仓山区,学生街,5.0,单人化妆,9.9,0
魅绣,仓山区,榕城广场/金山公交站,4.7,单次活泉水动力面部护理,88,0
Susie苏西造型阁,仓山区,榕城广场/金山公交站,5.0,单人面部护理套餐,98,0
指耀美美甲,仓山区,仓山区,5.0,面部精油护理,58,0
万佳汇健康会所（上街店）,闽侯县,博仕后购物广场/福州大学城,5.0,单人足浴/推拿2选1,128,977
御足阁休闲会所,闽侯县,闽侯县,5.0,单人推拿,65,668
舒梦养生堂（甘蔗店）,闽侯县,闽侯县,4.6,单人推拿/足按2选1,98,441
康美推拿足浴,闽侯县,博仕后购物广场/福州大学城,4.8,单人养生推拿套餐,89,318
同心健康会馆,闽侯县,闽侯县,5.0,单人推拿足按2选1,98,166
任氏美胸冰点净肤机构,闽侯县,闽侯县,5.0,单人净手指毛/比基尼/唇部3选1包干套餐,338,163
爱宝贝母婴spa生活馆,闽侯县,博仕后购物广场/福州大学城,4.6,婴幼儿单人游泳套餐,38,141
微步足道（闽侯店）,闽侯县,闽侯县,4.2,单人推拿足浴套餐,99,71
养和堂,闽侯县,博仕后购物广场/福州大学城,5.0,单人颈肩养护套餐,99,48
美界美颜馆,闽侯县,博仕后购物广场/福州大学城,5.0,单人精致修眉套餐,1,42
康之家足浴推拿养生馆,闽侯县,闽侯县,4.7,单人足按,45,40
片仔癀护肤馆,闽侯县,闽侯县,5.0,面部护理套餐,58,39
泰之然尊贵养生会所,闽侯县,博仕后购物广场/福州大学城,5.0,单人养生套餐2选1,128,36
百分百专业祛痘减肥,闽侯县,博仕后购物广场/福州大学城,5.0,单人专业面部护理,29,25
养和堂（闽都店）,闽侯县,博仕后购物广场/福州大学城,4.7,单人小儿推拿保健脾胃套餐,99,15
百合秀然祛痘,闽侯县,闽侯县,5.0,单人面部净排1次,19.9,14
心梦缘健康养生馆,闽侯县,闽侯县,3.7,油压+足浴,198,13
靓容阁,闽侯县,新西客站,3.0,单人面部有氧水疗套餐,19.9,3
知发者美容美发连锁,闽侯县,博仕后购物广场/福州大学城,3.5,单人养生拔罐套餐,9.9,3
可诺丹婷美容院（胜利店）,长乐市,步行街,3.6,可诺丹婷美颜美体连锁特惠丽人套餐,38,390
可诺丹婷美容院（长乐店）,长乐市,河下街,3.6,可诺丹婷美颜美体连锁特惠丽人套餐,38,390
淑女好逑美容spa会所（永乐花园店）,长乐市,锦江花园,5.0,淑女好逑五行经络舒通单人套餐,68,152
郑远元专业修脚房（吴航路店）,长乐市,市标,4.6,郑远元单人舒克脚腾片,50,119
郑远元修脚房（长乐民主街店）,长乐市,河下街,4.6,郑远元单人舒克脚腾片,50,119
郑远元修脚房（长乐爱心路店）,长乐市,闽运汽车站,4.8,郑远元单人舒克脚腾片,50,119
郑远元修脚房（郑和中路店）,长乐市,西洋,3.7,郑远元单人舒克脚腾片,50,119
郑远元修脚房（长乐郑和西路店）,长乐市,锦江花园,4.4,郑远元单人舒克脚腾片,50,119
美姿城美容养生会所（长乐西洋店）,长乐市,闽运汽车站,4.6,单人肩颈通络调理套餐,68,65
蕾特恩专业祛痘连锁（长乐店）,长乐市,西洋,5.0,单人DNA靶向黑头析出套餐,19.8,36
无忧空间养生会所,长乐市,金峰镇,4.2,中式推拿/养生足浴2选1,98,36
瑞丽女人,长乐市,锦江花园,3.9,美白补水体验一次单人套餐,18,28
韩艺美肤spa中心,长乐市,西洋,5.0,韩国小气泡深层皮肤清洁套餐,99,25
逍遥宫时尚休闲俱乐部,长乐市,西洋,5.0,单人高级逍遥情全身油推1节,368,24
锦尚国际美容美发,长乐市,长乐,3.7,芳香开背、面部玉疗,128,0
康乐盲人按摩（万福巷店）,连江县,北岳大厦,4.3,康乐盲人按摩3选1,60,356
金苹果专业减肥,连江县,连江,4.6,精油开背按摩,9.8,274
名人足道会所,连江县,连江,5.0,单人推拿+足按白场特惠套餐,138,171
水都名媛（连江凤园路店）,连江县,连江,5.0,单人水都拔火罐1次,9.9,165
郑远元专业修脚房（连江凤园路店）,连江县,连江,4.0,郑远元单人舒克脚腾片,50,119
郑远元专业修脚房（开放路店）,连江县,连江,4.0,郑远元单人舒克脚腾片,50,119
郑远元专业修脚房（文山南路店）,连江县,连江,4.0,郑远元单人舒克脚腾片,50,119
豪鑫源足道,连江县,北岳大厦,4.0,单人精油开背1次,118,113
贵安儿童职业体验海洋世界,连江县,贵安新天地,4.0,"溪山温泉度假酒店, 可选水世界（夜场）/欢乐世界(夜场）/温泉+鱼疗+养生餐+SPA按摩+御康汇/防水袋",430,88
贵安水世界,连江县,贵安新天地,4.6,"溪山温泉度假酒店, 可选水世界（夜场）/欢乐世界(夜场）/温泉+鱼疗+养生餐+SPA按摩+御康汇/防水袋",430,88
贵安奇趣家儿童职业体验中心,连江县,贵安新天地,4.4,"溪山温泉度假酒店, 可选水世界（夜场）/欢乐世界(夜场）/温泉+鱼疗+养生餐+SPA按摩+御康汇/防水袋",430,88
溪山温泉酒店,连江县,连江,4.6,"溪山温泉度假酒店, 可选水世界（夜场）/欢乐世界(夜场）/温泉+鱼疗+养生餐+SPA按摩+御康汇/防水袋",430,88
贵安欢乐世界,连江县,贵安新天地,4.5,"溪山温泉度假酒店, 可选水世界（夜场）/欢乐世界(夜场）/温泉+鱼疗+养生餐+SPA按摩+御康汇/防水袋",430,88
溪山温泉度假酒店,连江县,连江,4.8,"溪山温泉度假酒店, 可选水世界（夜场）/欢乐世界(夜场）/温泉+鱼疗+养生餐+SPA按摩+御康汇/防水袋",430,88
典妆美学馆,连江县,贵安新天地,5.0,单人生活化妆（化妆＋造型）,19.9,48
可诺丹婷美容院（皇家店）,连江县,连江,3.6,美颜美体单人套餐,88,14
盲人健康推拿店（马鼻店）,连江县,连江,3.5,单人推拿套餐,100,0
安然健康生活馆,连江县,连江,4.4,安然健康养生馆单人开背,89,0
熊熊美容汗蒸馆,永泰县,永盛大厦,4.5,单人汗蒸一次,18,12
佳馨媛美容美甲中医养生会所,永泰县,永泰县,5.0,罗美诗野菜排污修护套装,168,0
