商家,区域,商圈,星级,服务,价格,销量
泓扬减肥养生美容,南明区,鸿通城,4.7,肩颈调理单人套餐,38,29
路易.芬尼国际名媛美容养生馆,南明区,花果园,4.2,单人全身高端护理,68,28
指颜工坊,南明区,大南门,5.0,韩式基础补水皮肤管理单人套餐,79.9,28
锦馨足疗保健养生馆（新华路店）,南明区,新华路,5.0,单人豪华足浴套餐（50分钟）,48,27
韩方科颜国际专业祛痘连锁机构,南明区,花果园,4.8,魔镜特惠测试皮肤,1,15
美颜本草堂纯中药专业祛痘.祛斑,南明区,南明区,4.8,面部纯中式痘肌护理补水淡斑单人体验,28.8,15
惠美佳皮肤抗衰管理机构,南明区,市南路,4.4,单人靓颜清肤护理体验,188,15
然spa城市生活馆,南明区,油榨街,4.7,古法肩颈,58,15
舒美养生馆,南明区,南明区,5.0,[本季热推]肩颈调理（50分钟）,68,14
一揽芳华美甲美睫半永久美妆,南明区,花果园,5.0,个性精致小纹身【5厘米内】,106,13
雅馨美容美体中心,南明区,花果园,5.0,雅馨美容肩颈舒压,39.8,13
青之茂美容塑形养身阁,南明区,花果园,4.8,单人肩颈40分钟经络套餐,68,13
诗雨养生馆,南明区,南明区,4.0,单人面部五重补水三重锁水,29.9,13
方冠（杨氏亨特店）,南明区,亨特City Mall,4.9,单人精油开背+头部护理,58,13
阳阳美容美体养生会所,南明区,市南路,4.9,单人肩颈疏通套餐,98,13
secret queen秘密皇后美容美体工作室,南明区,花果园,4.6,终身冰点脱毛单次体验,98,12
s.l生丽美容馆,南明区,南明区,5.0,背部护理套餐,19.9,11
紫轩美容养生会所,南明区,花果园,4.3,单人面部香薰护理+带脉保养套餐,99,11
黛薇雅容颜私人会所,南明区,花果园,5.0,单人拔罐/刮痧体验2选1,8.8,11
Pretty Y. 私人订制美颜室,南明区,花果园,4.8,单人精致生活妆1次,49,11
努米娜美睫工作室,南明区,花果园,5.0,皙之密私人订制面部护理,18.8,11
雅颜美容养生坊（半山小镇店）,南明区,花果园,4.6,单人护理套餐二选一,9.9,11
偶钰美甲美妆工作室,南明区,花果园,4.5,偶钰高级手臂spa护理套餐,39.9,1
紫莲凯娜（花果园店）,南明区,花果园,4.0,单人紫莲凯娜四国风情SPA,98,1
天合道重庆富侨（次南门店）,南明区,河滨公园,4.4,单人仲景养生,188,1
快乐瘦减肥养生连锁（文昌北路店）,南明区,甲秀楼,4.0,单人面部提升套餐,138,0
优德伊美,南明区,市南路,3.0,单人Aqua Peel小气泡活肤管理,299,0
瑰丽美颜馆,南明区,市南路,4.6,单人24k黄金焕肤面膜,680,0
Abby美甲美睫工作室,南明区,花果园,4.6,温和毛发管理,99,0
skin纤体美容馆,南明区,亨特City Mall,4.5,面部美肤紧致+臀部腰部塑形,588,0
韩研半永久私人定制美甲沙龙,南明区,花果园,4.7,单人汗蒸+五星级头疗,108,0
千面美甲,南明区,南明区,5.0,面部精致SPA护理,49.9,0
青丘工作室,南明区,花果园,5.0,四海八荒美丽上神妆,20,0
一绣倾城美甲美容纹绣,南明区,花果园,5.0,单人美容纤体塑性套餐,68,0
今儿美甲美睫纹绣,南明区,花果园,5.0,单人韩式眼线设计,890,0
维娜斯美颜坊,南明区,南明区,5.0,扶正瘦身护理（限时抢购）,29.9,0
维尔纳半永久定妆机构,南明区,花果园,4.6,水氧透白樱花嫩肤,68,0
Sasa美容管理中心,南明区,花果园,4.4,养生单人套餐,198,0
沐容清秀半永久定妆美甲美睫,南明区,花果园,5.0,洗脸按摩套餐,88,0
幻颜美甲工作室,南明区,花果园,5.0,单人定制眉型设计,698,0
YONZY容貌形象管理,南明区,花果园,4.6,皮肤管理韩国进口护理,88,0
红妍丽人,白云区,大山洞,5.0,单人美容套餐,28,240
白云自强盲人按摩中心,白云区,同心路,5.0,单人盲人按摩,58,169
怡天下足疗保健会所,白云区,西南家具城,5.0,单人美足浴80分钟,88,136
豪门贵足,白云区,七一路,5.0,单人修脚/采耳二选一,10,118
重庆富侨（白云店）,白云区,同心路,5.0,单人姜疗御足,138,106
秀域科技美容（白云店）,白云区,大山洞,3.9,高科技生活美容单次体验课程,129,104
聂若羽纤体美颜女子会所,白云区,白云公园,4.5,养身spa美容套餐,128,87
瑶芳清颜专业祛痘美容中心（白云店）,白云区,澳马步行街,3.9,单人定制细胞透析补水,68,36
温馨足疗,白云区,同心路,4.1,草本足疗+泰式按摩+火动力 套餐,125,25
指尖芭蕾,白云区,白云区,4.0,单人精致生活妆,10,13
名媛汇美甲美睫半永久——AIshang总店,白云区,大山洞,5.0,尊贵脸部补水套餐,128,2
MADE·眉眼唇定制中心,白云区,白云区,4.7,单人韩式美瞳眼线,680,1
君康盲人按摩,乌当区,新添寨,5.0,单人中式按摩（60分钟）,65,4170
天合道重庆富侨（乌当店）,乌当区,顺海,4.7,单人贵宾足疗1次,98,3992
保利国际温泉,乌当区,保利温泉新城,4.6,"保利•国际温泉门票＋全身舒络推拿套餐成人票,入园前均可购买",156,3114
瑶香灵谷SPA,乌当区,新添寨,5.0,肩颈+背部护理套餐,138,1365
重庆富侨（新添寨店）,乌当区,乌当区,4.9,泰式保健套餐,168,799
逸足轩,乌当区,新添寨,3.9,单人包房足浴套餐,58,775
香港SC形色美妆连锁（金阳店）,乌当区,金阳新世界,5.0,单人嫁接睫毛,88,513
鑫助盲人专业推拿,乌当区,金阳新世界,5.0,单人普通保健按摩套餐,58,405
泊莱瑞美容会所,乌当区,正德家邦购物中心,5.0,单人SPA美容保养3选1,29.9,251
水胭脂美容养生SPA连锁机构,乌当区,金阳新世界,5.0,高端美容护理,58,177
盲道足疗按摩店（乌当区店）,乌当区,正德家邦购物中心,5.0,单人中式推拿按摩（60分钟）,48,139
御灵雅·足疗保健,乌当区,新添寨,4.3,单人保健套餐,98,77
SUNLAND SPA（贵御温泉连锁店）,乌当区,新添寨,5.0,温泉/茶点/住宿/SPA双人套餐,998,77
瑶芳清颜专业祛痘祛斑美容中心（新添寨店）,乌当区,乌当区,3.5,单人定制细胞透析补水,68,36
瑞泊莱莉国际美容（两店通用）,乌当区,新添寨,5.0,单人全身经络SPA套餐,68,33
国颐堂养发spa馆（天芝都美业）,乌当区,金阳新世界,4.0,单人基础保养,38,19
爱美丽,乌当区,新添寨,4.9,美容身体7选3单人套餐,98,15
娴媛阁沙疗馆,乌当区,乌当区,4.3,单人娴媛阁沙疗馆超值靓丽女人套餐,39.9,15
伊卜美甲美睫,乌当区,保利温泉新城,4.6,小气泡管理美容套餐,168,12
克丽缇娜（保利温泉店）,乌当区,保利温泉新城,4.9,徒手面部小V脸,68,10
本草秀复除疤祛痘（乌当区新添寨店）,乌当区,新添寨,5.0,单人养生拔罐体验套餐,36.8,3
养生堂,乌当区,乌当区,4.9,肩颈护理,18.8,3
印奈儿美甲手足护理机构,乌当区,正德家邦购物中心,4.9,【经络疏通】手部经络疏通/足部护理2选1,58,1
古贝私人订制工作室,乌当区,乌当区,5.0,面部草本熏蒸,29.8,0
露缇娜纤体美容养生会所,花溪区,十字街,4.0,单人汉方肩颈调理,69.9,125
秀域科技美容（小河门店）,花溪区,花溪区,3.9,高科技生活美容单次体验课程,129,104
凯斐蒂美容养生,花溪区,小河-海纳广场,5.0,单人肩颈护理套餐,48,92
靓颜养生会所SPA生活馆,花溪区,小河-黄河路,4.3,单人肩颈护理,28.8,89
汐更美美容养生连锁（沐溪店）,花溪区,花溪区,4.0,单人汐-面部防晒护理,68,84
康复盲人按摩院,花溪区,花溪区,4.8,单人保健按摩,34.9,75
芳茗足疗养生馆,花溪区,徐家冲,5.0,单人中式足疗+按摩,68,75
御福康养生堂（小河店）,花溪区,小河-黄河路,4.4,单人纳米汗蒸,12.8,80
绿瘦美学馆,花溪区,万科大都会,4.7,深层补水保湿单人套餐,39.9,72
黔梦源美容养发馆,花溪区,小河-海纳广场,4.0,黔梦源美容养发馆美容护理套餐 长城嘉苑,26,63
植美人（星力超市店）,花溪区,农院,4.7,单人植美人养生套餐,128,62
馨月丽佳人美容养生馆,花溪区,万科大都会,5.0,精致面部护理,9.9,62
黔城名媛美容院,花溪区,花溪区,4.5,单人黔城名媛芳香精油背部护理,39,42
大嘴鱼风情鱼疗馆,花溪区,花溪区,4.6,单人鱼疗20分钟劲爆单,9.9,45
悦美诗瘦身美肤私人订制,花溪区,小河-黄河路,5.0,五行背部罐疗祛湿寒一次,8.8,43
瑶芳清颜专业祛痘美容中心（花溪店）,花溪区,十字街,5.0,单人定制细胞透析补水,68,36
瑶芳清颜专业祛痘美容中心（小河店）,花溪区,小河-黄河路,5.0,单人定制细胞透析补水,68,36
安尚瘦身纤体美容馆（小河店）,花溪区,小河-黄河路,5.0,单人逆龄V脸紧致提升+面部补水护理,68,35
漫时光美容养生馆,花溪区,小河-黔江路,5.0,美容美体汗蒸体验+沐浴,26,32
艺佳宏盲人中医推拿,花溪区,花溪区,5.0,全身专业推拿（60分钟）,43.8,32
恋指缘纹绣魅力女人私人定制,花溪区,花溪公园,4.7,恋指缘单人拔罐,9.9,30
益颜堂中医养生馆（万科店）,花溪区,万科大都会,4.9,[招牌]中式传统本草肩颈调理（60分钟）,98,33
筋骨养护生活馆,花溪区,花溪区,5.0,单人拔罐,9.9,28
Asia Beauty肌肤管理中心,花溪区,花溪区,5.0,韩国DMS保湿课程单人套餐,29.8,28
盛康盲人按摩,花溪区,花溪区,4.6,全身保健按摩（60分钟）,49.8,27
新天润美容养生馆,花溪区,小河-珠江路,5.0,药疚肩颈调理,68,24
一绣倾城妆容管理形象中心,花溪区,花溪区,4.3,一绣倾城单人身体护理,29.9,21
指尖专业美甲手护,花溪区,十字街,4.2,嫁接仿真睫毛（指尖美甲）,68,21
绿美国际,花溪区,小河-海纳广场,4.2,黑脸娃娃,68,16
玛蒂娜美容养生馆,花溪区,花溪区,4.0,单人身体护理套餐,15.9,15
黔足养生堂,花溪区,新区,4.2,[人气]中华养生（110分钟）,199,15
摩道生活意境养生馆,花溪区,农院,4.3,单人芳香SPA,268,15
百年吴越专业祛痘连锁机构（小河店）,花溪区,小河-海纳广场,4.1,单人补水3次护理套餐,168,13
健康园按摩养生馆,花溪区,老牛马市,4.0,单人刮痧或拔罐套餐,20,12
美雅阁美容养生馆（贵阳分店）,花溪区,小河-黄河路,4.9,单人肩颈精油调理套餐,58,11
鸿福汗蒸养生馆,花溪区,小河-海纳广场,5.0,单人肩颈调理,58,8
黔唐金粉养生足道会所,花溪区,花溪区,4.8,单人馥芳捻指,248,8
立瘦专业减肥中心（小河店）,花溪区,花溪区,5.0,单人刮痧拔罐体验套餐,16.8,8
千姿菩提岸spa,花溪区,徐家冲,4.9,菩提SPA美容养生套餐,128,8
FITASPA非亣美汇,花溪区,花溪区,3.5,全身经络SPA单人套餐,198,6
冰夏绣妆,花溪区,小河-黄河路,5.0,单人SPA肩颈经络调理,68,6
『涂颜绣色』美甲美睫半永久定妆,花溪区,十字街,5.0,面部spa水润/鼻头清洁/痘肌护理,28.8,4
易超美容美体连锁机构,花溪区,学士路,4.4,脊椎矫正,68,3
韩妃国际面容美丽定制中心（小河转盘店）,花溪区,花溪区,5.0,深层清洁祛黑头美容套餐,39.8,3
享瘦减肥养生会所,花溪区,花溪区,4.5,排寒、排湿,89,0
华夏良子（贵阳会展店）,观山湖区,美的林城时代,5.0,代金券,75,11154
合一堂,观山湖区,观山湖区,5.0,单人足浴+肩颈疏通,79.9,2026
贵阳市盲人按摩足疗中心,观山湖区,红街,5.0,单人盲人按摩,58,1715
观山湖严师筋骨养护馆,观山湖区,金阳商业步行街,5.0,单人全身按摩,44.9,1116
家乐康足道（金阳红街店）,观山湖区,观山湖区,4.8,单人中华养生/古典泰式二选一,208,1082
旭康盲人专业推拿（会展店）,观山湖区,观山湖区,5.0,单人按摩套餐,56,748
旭康盲人推拿,观山湖区,金阳商业步行街,4.8,全身按摩,46,740
涌泉堂养生馆,观山湖区,观山湖区,4.8,单人足疗套餐,60,671
益康轩足疗会馆,观山湖区,观山湖区,4.8,单人古典泰式按摩,158,490
阳光美容,观山湖区,长岭南路,4.6,肩颈理疗+背部刮痧拔罐    10,28,416
鑫助盲人专业推拿（中天会展城店）,观山湖区,观山湖区,4.8,单人普通保健按摩套餐,58,405
美美哒·御森堂养生保健会所,观山湖区,世纪金源购物中心,4.9,单人超值肩颈双疏调理套餐,68,390
亿家康(世纪金源购物中心店),观山湖区,观山湖区,5.0,采耳/修脚2选1,5,356
冰灵SPA,观山湖区,观山湖公园,5.0,单人特色专属spa套餐,188,298
尚御足道,观山湖区,金阳商业步行街,5.0,单人沐足套餐,88,266
云刚盲人按摩所,观山湖区,观山湖区,5.0,单人按摩全身,59,253
启元美容养生馆,观山湖区,美的林城时代,4.6,背部推柔+拔罐套餐,68,232
黔和堂养生足疗会所,观山湖区,观山湖区,5.0,单人非凡足迹,168,220
慧鑫足道,观山湖区,观山湖公园,5.0,单人足浴套餐,108,209
晨光義展足疗养生会所,观山湖区,观山湖区,5.0,单人拔罐套餐,8,176
刘瑛盲人按摩院（金阳世纪城店）,观山湖区,金源街,5.0,多面手-单人全身按摩,42,177
脉道养生会所,观山湖区,金阳商业步行街,5.0,脉道SPA套餐,238,158
伊人香颜美容美发足疗养生连锁（金阳店）,观山湖区,金源街,4.2,单人头疗+刮痧,59.9,148
康妮轩美容养生会所,观山湖区,观山湖区,4.9,单人超值特色肩颈调理,68,136
医美莱光电美肤中心（金源街店）,观山湖区,金源街,4.9,【痣】淡痣一颗,10,107
重庆富侨（观山湖会展店）,观山湖区,金朱东路,5.0,仲景养身【周年庆特惠白天场】,158,108
吉兴足疗汗蒸养生馆,观山湖区,中天帝景传说,4.6,单人中式按摩套餐,60,105
轩平享美容养生会所,观山湖区,龙泉苑街,4.4,肩颈+拔罐/刮痧单人套餐,68,97
大汉松骨足疗城,观山湖区,观山湖区,4.8,单人大汉泰式按摩,158,92
御福康中医养生会所（世纪城店）,观山湖区,观山湖区,5.0,单人拔罐刮痧,28,86
美懿美容养生会所,观山湖区,世纪金源购物中心,5.0,颈部淋巴净排、面部经络净排等套餐,99,85
罗兰佩蒂健康抗衰spa会所,观山湖区,绿地联盛,4.7,生命之柱养生护理,98,75
皇家御足,观山湖区,观山湖区,4.8,单人传承养生套餐,328,71
欧雅米兰养生馆,观山湖区,龙泉苑街,5.0,巴基斯坦盐屋汗蒸,29,68
馥蝶修颜舍,观山湖区,美的林城时代,5.0,单人基础面部护理（补水/细致/嫩滑）（赠送亲子摄影写真体验）,58,62
一品足疗养生堂（金阳北路店）,观山湖区,观山湖公园,5.0,经络养生套餐,168,59
壹方美妆,观山湖区,福州街,4.0,化妆套餐,19.9,55
碧玺沙灸（龙城店）,观山湖区,合肥路,4.6,单人碧玺沙灸+肩颈护理,168,54
富阁足疗馆,观山湖区,观山湖区,4.5,单人古典泰式按摩,148,53
安悦美健康养生会所,观山湖区,福州街,5.0,贵族~单人套餐,68,43
艾丽思美容养生会所,观山湖区,观山湖区,4.7,单人肩颈按摩+拔罐/刮痧套餐,48,42
御足堂,观山湖区,观山湖区,5.0,单人经典御足,78,42
梦颜堂国际美容养生中心,观山湖区,美的林城时代,5.0,【肩颈按摩】肩颈调理体验套餐,98,36
王萍美容院,观山湖区,金源街,4.0,单人美容养生套餐,198,25
维纳斯美容美发,观山湖区,观山湖区,4.1,维纳斯肩颈疏通保养单人体验套餐,68,24
波波美容美体,观山湖区,金阳商业步行街,4.1,单人豪华spa套餐,168,16
波波美容美体养生馆,观山湖区,金阳商业步行街,4.9,单人豪华spa套餐,168,16
丹妮斯美容美睫会所,观山湖区,观山湖区,4.7,千丝无痕美睫,48,13
初瑶·瑶浴（观山湖店）,观山湖区,观山湖区,5.0,现熬瑶浴+面部护理+头疗+洗护发,168,13
艾美美容美甲半永久工作室,观山湖区,观山湖区,5.0,超值肩颈疏通调理,68,12
香薰之苑女子美容会所,观山湖区,龙泉苑街,4.1,6折优惠 薰衣草按摩油全身护理单人套餐,118,12
陈吉勇推拿中心,观山湖区,观山湖区,4.4,拔罐或足浴泡脚,8.8,9
瑶芳清颜专业祛痘美容中心（金阳店）,观山湖区,观山湖区,5.0,单人肩颈疏通,68,8
宇美国际,观山湖区,观山湖区,5.0,综合美学形象设计,1,7
易德足疗养生馆,观山湖区,长岭南路,5.0,单人全身推拿,168,6
盛汇护肤造型生活馆,观山湖区,龙泉苑街,3.9,单人盛汇身体护理套餐,128,6
爱美国际护肤造型（龙凯苑店）,观山湖区,合肥路,4.2,身体护理5选1单人套餐,258,5
臻美国际美容养生会所,观山湖区,金源街,4.6,臻美国际单人面部补水体验,58,4
淘米水养发馆（会展城店）,观山湖区,中天会展城B区,4.6,美白红润面膜,20,3
玉足轩养生馆,观山湖区,红街,4.2,单人中华养生套餐,188,3
富康丽人美容养生会所,观山湖区,福州街,4.8,暖宫驱寒,98,3
TT.Wedding新秘工作室,观山湖区,金阳商业步行街,4.6,美容面部护理,38,3
涵芷私人定制,观山湖区,观山湖区,4.6,面部SPA美容美白套餐,19.9,2
丽源阳光养生馆,观山湖区,合肥路,4.4,阿育吠陀单人保养套餐,138,2
涵曦体验馆,观山湖区,龙泉苑街,4.8,单人面部紧致提拉/补水,41,1
清韵养生会所（安然纳米汗蒸金阳店）,观山湖区,金朱东路,4.7,代金券,1,1
艺丽美甲纹绣专业纹身,观山湖区,观山湖区,5.0,纤体美容瘦身套餐,98,1
睫毛弯弯美甲美睫,观山湖区,福州街,5.0,面部水润+美胸美容美体套餐,98,1
煊美名妆,观山湖区,观山湖区,4.1,单人美容美体套餐,68,0
小资生活,观山湖区,金阳商业步行街,4.5,单人韩式眉,1280,0
艺苑.纹彩美妆工作室,观山湖区,观山湖区,4.6,单人面部套餐,58,0
丽源阳光养生馆,观山湖区,合肥路,3.5,单人皇宫秘笈,158,0
