商家,区域,商圈,星级,服务,价格,销量
壹品足道（华福店）,鼓楼区,五一广场/古田路,5.0,单人开背套餐,149,1912
abc休闲会所,鼓楼区,东街口/三坊七巷,4.2,ABC休闲会所单人韩式优指,219,1847
御尚阳光,鼓楼区,鼓楼区,5.0,单人花香养生,238,1660
泰自然（金龙店）,鼓楼区,温泉公园/福州广场,5.0,单人泰式精油套餐,169,1605
医健源推拿馆,鼓楼区,东街口/三坊七巷,5.0,单人全身推拿,69,1375
树汤盲人推拿,鼓楼区,温泉公园/福州广场,5.0,单人盲人推拿,47.9,1190
澜湖世纪温泉会所,鼓楼区,乌山/冠亚广场,5.0,中式超值2选1套餐,249,993
御品会养生会所,鼓楼区,鼓楼区,5.0,单人足浴/推拿2选1,99,967
平凡中式推拿,鼓楼区,省体/湖前,5.0,单人足浴/推拿2选1,48,863
海悦会养生会所,鼓楼区,黎明/小柳市场,5.0,【特惠套餐】单人精油开背+拔罐/刮痧/采耳 3选1,168,854
福榕盲人推拿中心,鼓楼区,东街口/三坊七巷,5.0,推拿/足按/刮痧【3选1】,48,745
法国安杰玛SPA会所（衣锦华庭店）,鼓楼区,东街口/三坊七巷,3.5,单人护理套餐4选1,198,553
安然纳米汗蒸馆（三坊七巷店）,鼓楼区,东街口/三坊七巷,5.0,背部养生套餐,98,552
安然宝贝汗蒸馆（旗舰店）,鼓楼区,鼓楼区,5.0,安然宝贝单人体验汗蒸,18,509
石兴凯减肥/美容/美体/养生（福州分院）,鼓楼区,东街口/三坊七巷,4.6,单人石兴凯中式经络套餐,98,477
爱心盲人推拿,鼓楼区,温泉公园/福州广场,5.0,单人套餐3选1,69.8,466
一冠养生,鼓楼区,五四路,5.0,单人五行拔罐/刮痧2选1,9.9,463
可诺丹婷美容院（东百店）,鼓楼区,东街口/三坊七巷,3.6,可诺丹婷美颜美体连锁特惠丽人套餐,38,390
可诺丹婷美容院（新天地店）,鼓楼区,五四路,3.6,可诺丹婷美颜美体连锁特惠丽人套餐,38,390
可诺丹婷美容院（银湖店）,鼓楼区,左海/西湖公园,3.6,可诺丹婷美颜美体连锁特惠丽人套餐,38,390
可诺丹婷美容院（国棉店）,鼓楼区,省体/湖前,3.6,可诺丹婷美颜美体连锁特惠丽人套餐,38,390
思妍丽(大洋晶典冠亚店),鼓楼区,乌山/冠亚广场,4.2,原花香水润升级DR Bio多肽护理,288,390
可诺丹婷美容院（六一店）,鼓楼区,鼓楼区,3.6,可诺丹婷美颜美体连锁特惠丽人套餐,38,390
万利泉SPA水疗会所,鼓楼区,鼓屏路/屏山公园,4.8,双人万利泉SPA套餐,298,371
伊芙世家尊品时尚spa会所（东百会所）,鼓楼区,东街口/三坊七巷,4.9,单人肽水润面部补水保湿护理套餐1次,258,363
伊芙世家尊品时尚spa会所（湖东会所）,鼓楼区,鼓楼区,4.4,单人肽水润面部补水保湿护理套餐1次,258,363
伊芙世家尊品时尚spa会所（宫廷会所）,鼓楼区,东街口/三坊七巷,4.8,单人肽水润面部补水保湿护理套餐1次,258,363
葛姐足浴推拿中心,鼓楼区,东街口/三坊七巷,5.0,单人足浴推拿套餐,75,358
领秀Spa美甲,鼓楼区,鼓楼区,5.0,单人时尚美甲套餐,38,355
东方美美容院（华林会所）,鼓楼区,五四路,4.5,单人美容套餐,108,349
东方美美容院（西湖会所店）,鼓楼区,左海/西湖公园,5.0,单人美容套餐,108,349
东方美美容院（东街会所）,鼓楼区,东街口/三坊七巷,4.1,单人美容套餐,108,349
东方美美容院(正大广场店),鼓楼区,五一广场/古田路,4.6,单人美容套餐,108,349
亲亲冰点皮肤管理中心（帝豪店）,鼓楼区,温泉公园/福州广场,5.0,单人腋下脱·毛/唇部脱·毛2选1,39,346
蒸灸堂经络推拿,鼓楼区,东街口/三坊七巷,5.0,单人正骨推拿,46,310
华夏足道（鼓东店）,鼓楼区,东街口/三坊七巷,5.0,单人开背+足浴套餐,148,251
肤之净专业祛斑,鼓楼区,五一广场/古田路,5.0,黑脸娃娃,59.9,246
金乐福足浴推拿（达明路店）,鼓楼区,东街口/三坊七巷,4.8,乐福推拿/足按2选1,68,238
8号温泉汤池,鼓楼区,铜盘路/软件园,4.7,单人澳8温泉养生SPA,298,220
刘烽盲人中医推拿,鼓楼区,五一广场/古田路,5.0,足按、推拿套餐,48,181
静美甲,鼓楼区,省立/旗汛口,5.0,单人光疗套餐,70,116
伊芙世家尊品爱美尔会所（爱美尔）,鼓楼区,鼓楼区,5.0,盛夏专场优惠脱毛腋毛包干套餐,98,117
台湾舒筋堂理疗馆,鼓楼区,省立/旗汛口,5.0,单人拔罐刮痧二选一,38,110
芭缇薇儿,鼓楼区,五一广场/古田路,5.0,单人养生护理套餐,128,110
秀域科技美容（洪山桥店）,鼓楼区,金牛山/洪山桥,4.0,高科技生活美容单次体验课程,129,103
秀域科技美容（米罗）,鼓楼区,省体/湖前,4.4,高科技生活美容单次体验课程,129,103
秀域科技美容（华城店）,鼓楼区,鼓楼区,4.0,高科技生活美容单次体验课程,129,103
秀域古方减肥（大儒店）,鼓楼区,金牛山/洪山桥,4.0,高科技生活美容单次体验课程,129,103
秀域科技美容（庆城店）,鼓楼区,省体/湖前,4.0,高科技生活美容单次体验课程,129,103
秀域科技美容（铜盘店）,鼓楼区,铜盘路/软件园,4.0,高科技生活美容单次体验课程,129,103
钦点养生足浴,鼓楼区,东街口/三坊七巷,4.2,钦点养生足浴,42,100
婕妤女子生活美容馆,鼓楼区,五四路,4.3,单人千方热能温宫泥灸/肩颈热能舒畅泥灸二选一,25,100
静水宁心瑜伽spa,鼓楼区,铜盘路/软件园,4.2,单人瑜伽课体验2次,29.9,99
益生园中医经络推拿,鼓楼区,东街口/三坊七巷,5.0,单人精油推背+刮痧/火罐套餐,108,90
伊莱美芙美容会所（鼓楼店）,鼓楼区,铜盘路/软件园,4.2,福州伊莱美芙美容会所美容单人套餐,78,84
MC生活美学mini馆,鼓楼区,鼓楼区,5.0,韩式小气泡深层清洁护理套餐,88,76
吴氏中医盲人推拿,鼓楼区,东街口/三坊七巷,4.0,单人经络穴位推拿+足浴,88,75
吴氏中医盲人推拿足浴中心,鼓楼区,省立/旗汛口,5.0,单人经络穴位推拿+足浴,88,75
郑远元专业修脚房（省府店）,鼓楼区,东街口/三坊七巷,4.7,单人艾草泡脚,54,74
苗老祖专业祛痘（鼓楼店）,鼓楼区,省立/旗汛口,4.0,单人面部清洁护理套餐,32,73
自然园美容会所,鼓楼区,鼓楼区,4.2,单人自然园肩颈经络护理一次,48,41
不老神话,鼓楼区,铜盘路/软件园,5.0,补水+生态球套餐,68,39
美肤馆,鼓楼区,省体/湖前,4.9,单人芳香开背+刮痧+拔罐套餐,69.9,37
康宁松筋养生馆,鼓楼区,津泰路/协和医院,4.4,单人拔罐,50,36
康容堂脸部健康中心（杨桥店）,鼓楼区,东街口/三坊七巷,5.0,单人单次：韩式光子淡斑套餐,120,33
木可家生活馆,鼓楼区,东街口/三坊七巷,4.8,单人养发护理套餐,49.8,33
康容堂脸部健康中心（福州康容堂东街口店）,鼓楼区,东街口/三坊七巷,5.0,单人单次：韩式光子淡斑套餐,120,33
紫罗兰美容美体SPA,鼓楼区,省体/湖前,4.0,单人美容美体SPA,208,29
莎菲琳美容养生会所,鼓楼区,省体/湖前,4.9,菲丝六部传奇护理套餐,68,28
舒雅,鼓楼区,左海/西湖公园,3.7,单人嫁接睫毛套餐,36,28
唯美至尊生活馆,鼓楼区,五四路,4.2,面部护理单人套餐,19,25
LNOPI美玲娜美甲半永久定妆私人定制,鼓楼区,东街口/三坊七巷,4.4,十二正经经络疏通肩颈+背部,88,23
伊雅美容瘦身会所,鼓楼区,省立/旗汛口,4.5,单人美人计套餐6选4,88,23
魁元堂,鼓楼区,五四路,4.2,经络油推,88,22
一笑堂足按推拿,鼓楼区,省体/湖前,3.9,单人保健足按1次,55,21
牧朗中医理疗养生馆,鼓楼区,铜盘路/软件园,4.5,保健刮痧拔罐基础调理套餐,88,18
中艾堂中医健康养生馆,鼓楼区,温泉公园/福州广场,4.5,经络推拿,98,18
御容坊美容院,鼓楼区,左海/西湖公园,4.1,肩颈五行经络调理,38,18
经络康调理养护中心,鼓楼区,金牛山/洪山桥,4.3,单人拔罐,19.9,18
陈氏中医理疗馆,鼓楼区,金牛山/洪山桥,4.7,单人推拿+艾灸+拔罐,108,17
少林正骨堂,鼓楼区,左海/西湖公园,4.0,单人禅功推拿,89,17
玫瑰女人美容生活馆,鼓楼区,东街口/三坊七巷,4.2,单人尊贵面部套餐,98,17
LE CYGNE天鹅童话（金源店）,鼓楼区,温泉公园/福州广场,3.5,面部补水亮肤护理+身体舒缓护理综合精选套餐,128,16
莎菲琳名媛美容养生会所,鼓楼区,津泰路/协和医院,5.0,安然纳米汗蒸,38,16
LE CYGNE天鹅童话（五一店）,鼓楼区,五一广场/古田路,3.5,面部补水亮肤护理+身体舒缓护理综合精选套餐,128,16
韩美,鼓楼区,乌山西路,5.0,单人嘿脸娃娃美白套餐,199,15
小灯塔盲人康复按摩,鼓楼区,鼓楼区,4.8,精油开背,83,13
悦美皮肤管理中心,鼓楼区,鼓楼区,5.0,单人超值体验深层清洁补水管理,58,13
美汇养身会所,鼓楼区,东街口/三坊七巷,5.0,肩颈护理2次+太极神灸2次,58,13
S T思婷美颜美体私人定制,鼓楼区,五一广场/古田路,5.0,面部美白、补水、,68,12
珊瑚湾生活馆,鼓楼区,温泉公园/福州广场,4.1,单人面部护理套餐2选1,68,12
丝域之星健康生活馆,鼓楼区,五四路,4.2,单人拔罐套餐,25,11
澜馨养生会所,鼓楼区,五四路,4.5,单人面部清洁1次,38,10
焕颜专业祛痘,鼓楼区,蒙古营,5.0,单人男士面部清油补水护理1次,35,10
珈蔓柏纹眉绣眉美睫培训机构（鼓楼第1号店）,鼓楼区,蒙古营,5.0,单人提拉紧致皱套餐,980,9
伊人美美容美甲,鼓楼区,鼓楼区,4.7,单人护理养生套餐4选2,68,9
好再来盲人推拿,鼓楼区,左海/西湖公园,4.2,单人刮痧拔罐套餐,55,9
蓝丝美人健康生活馆,鼓楼区,省立/旗汛口,4.6,单人面部护理,38,8
荟一私属抗衰中心,鼓楼区,鼓楼区,3.5,单人碧波庭美容养生套餐5选1,68,7
CC.美体美甲工作室,鼓楼区,五四路,5.0,单人蜜蜡净毛体验套餐,88,6
瑶芳专业祛痘（五一北路店）,鼓楼区,蒙古营,5.0,单人面部补水1次,5.88,6
芊指绣美甲（西洪路店）,鼓楼区,东街口/三坊七巷,5.0,单人打耳洞1次,9.9,6
芬妮美容美体养生馆,鼓楼区,左海/西湖公园,4.1,芬妮美容38美容套餐,38,5
闽台养生馆,鼓楼区,鼓楼区,5.0,单人香薰养生SPA,338,5
爱不饰手,鼓楼区,五一广场/古田路,5.0,面部深层护理,68,4
涵曦瘦身瘦脸体验馆,鼓楼区,乌山/冠亚广场,3.0,单人脸部微雕/脸部婴儿肌2次体验套餐二选一,88,3
悦美人美容美体,鼓楼区,东街口/三坊七巷,4.5,单人美容套餐,38,3
伊米私人容貌管理工作室,鼓楼区,黎明/小柳市场,3.8,单人嫁接睫毛,10,3
梵语瑜伽会所,鼓楼区,鼓楼区,4.1,单人面部护理,48,3
唯臻阁,鼓楼区,五四路,4.0,单人韩式面部瓷肌护理,89,3
Face score高颜值妆容管理,鼓楼区,乌山/冠亚广场,4.0,单人韩式水晶裸妆,28,2
叁水美学连锁学院,鼓楼区,温泉公园/福州广场,4.5,单人蜜蜡净毛体验,58,2
珠玛瑜伽,鼓楼区,蒙古营,4.9,单人艾灸体验,5,2
水贵人美容美甲,鼓楼区,津泰路/协和医院,4.5,单人面部排螨套餐,68,2
VIVISPA 薇薇美,鼓楼区,省立/旗汛口,4.0,单人热力舒压芳疗护理,198,2
Pure skin 皮肤管理,鼓楼区,东街口/三坊七巷,3.5,单人面部水氧深层清洁管理套餐,180,2
悦美颜日式美甲美睫化妆店,鼓楼区,温泉公园/福州广场,4.0,生活精致化妆造型,98,2
创美韩式美甲美睫,鼓楼区,左海/西湖公园,4.7,单人精油开背,49,1
悦尚美养生美容SPA会所,鼓楼区,乌山西路,4.0,单人肩颈舒活3次体验,98,1
海峡整形美容医院,鼓楼区,左海/西湖公园,4.2,激光点痣套餐,50,1
美丽蜕变,鼓楼区,东街口/三坊七巷,4.5,手臂温和净肤包干套餐,1280,0
壹发（东街店）,鼓楼区,省立/旗汛口,5.0,美容超值体验套餐2选1,198,0
曼妃美容养生SPA会所,鼓楼区,黎明/小柳市场,3.8,汗蒸单人套餐,19.8,0
爱尚纹绣持久美妆高端私人定制会馆,鼓楼区,乌山/冠亚广场,4.1,单人水雾·眉/美·瞳线/水晶润·唇3选1套餐,888,0
人人知盲人推拿,鼓楼区,省体/湖前,4.5,综合调理套餐,110,0
云水禅心瑜伽会所,鼓楼区,鼓楼区,5.0,单人瑜伽护理1次,98,0
诗美妍美容美体养生SPA头疗（融侨锦江店）,鼓楼区,西禅寺,4.2,十四经络健康单人养护1次,69,0
领秀spa美容,鼓楼区,省立/旗汛口,4.2,单人局部瘦身套餐,138,0
世纪悠然,鼓楼区,五四路,3.9,单人减·肥,19.9,0
FASHION纹绣韩式半永久纹眉眼唇,鼓楼区,鼓楼区,5.0,单人净腋毛体验套餐,98,0
轩雅专业美容会所（台江万达店）,台江区,台江万达,4.9,单人冰点唇部/腋下净毛(包干)2选1,99,216
轩雅美容会所,台江区,宝龙城市广场,5.0,单人冰点唇部/腋下净毛(包干)2选1,99,216
诗静美,台江区,台江广场/元洪城,5.0,单人水漾舒缓套餐,38,194
点点滴滴婴幼儿游泳spa中心,台江区,台江万达,5.0,新生儿游泳体验套餐,10,189
米脂古法美疗,台江区,工业路/茶亭,4.8,单人精油开背,32.8,168
碧霞减肥美容养生会所,台江区,万象城,4.8,单人拔罐套餐,19.9,156
百媚千娇氧疗SPA馆（台江万达店）,台江区,台江万达,5.0,单人全身经络SPA套餐,68,150
可可休闲会所,台江区,宝龙城市广场,5.0,单人推拿1次,69.9,146
福康居休闲中心,台江区,台江广场/元洪城,3.7,福康居推拿足浴套餐,50,142
瑞倪维儿,台江区,宝龙城市广场,4.8,单人精油开背套餐,76,122
郑远元专业修脚房（交通西路店）,台江区,万象城,4.0,郑远元单人舒克脚腾片,50,119
郑远元专业修脚房（河下街店）,台江区,帮洲新区/三保园,4.5,郑远元单人舒克脚腾片,50,119
郑远元专业修脚房（学军路店）,台江区,时代名城/文化宫,4.0,郑远元单人舒克脚腾片,50,119
郑远元专业修脚房（群众路店）,台江区,工业路/茶亭,4.0,郑远元单人舒克脚腾片,50,119
郑远元修脚店（金屏巷店）,台江区,大利嘉/汽车南站,4.0,郑远元单人舒克脚腾片,50,119
郑远元专业修脚房（红庆路店）,台江区,工业路/茶亭,3.0,郑远元单人舒克脚腾片,50,119
郑远元专业修脚（西洋店）,台江区,工业路/茶亭,3.5,郑远元单人舒克脚腾片,50,119
郑远元专业修脚房（老药洲店）,台江区,台江广场/元洪城,4.0,郑远元单人舒克脚腾片,50,119
悦容堂,台江区,工业路/茶亭,5.0,单人美容美体养生套餐,69.9,115
nice奈斯化妆纹绣(宝龙城市广场店),台江区,宝龙城市广场,5.0,单人精致妆容套餐,38,111
秀域科技美容（茶亭店）,台江区,工业路/茶亭,4.0,高科技生活美容单次体验课程,129,103
秀域科技美容（宝龙店）,台江区,宝龙城市广场,4.0,高科技生活美容单次体验课程,129,103
秀域科技美容（海润滨江店）,台江区,台江万达,4.0,高科技生活美容单次体验课程,129,103
清华美疗工作室,台江区,宝龙城市广场,5.0,单人拔火罐套餐,9.9,95
风彩伊人瘦身馆,台江区,宝龙城市广场,5.0,单人刮痧/拔罐/汗蒸/艾灸4选1套餐,9.9,81
福建玫瑰谷美容养生会所（金融街万达店）,台江区,台江万达,5.0,单人精油开背,68,80
佳缘健康馆（茶亭店）,台江区,工业路/茶亭,5.0,单人中式推拿/足按2选1,128,81
Miss Charming半永久美颜定制,台江区,国货路/群升国际,5.0,单人点痣一次,1,74
昌鑫推拿足疗,台江区,工业路/茶亭,4.7,单人推拿足疗,33,71
美姿城美容养生会所（台江万达店）,台江区,台江万达,5.0,单人肩颈通络调理套餐,68,65
美姿城美容养生会所（百合店）,台江区,万象城,4.9,单人肩颈通络调理套餐,68,65
美姿城美容养生连锁机构（中央第五街会所）,台江区,万象城,4.6,单人肩颈通络调理套餐,68,65
艾拉Ella,台江区,国货路/群升国际,4.6,单人精油开背+无烟艾灸+经络疏通+拔罐+刮痧,98,62
U·Mei皮肤管理中心,台江区,万象城,5.0,脸、背部小气泡深层清洁(美白/补水/舒敏/祛痘/防老化可选),128,61
纤姿美体生活馆,台江区,国货路/群升国际,4.2,单人精油开背,38,59
善美抗衰美容SPA会所（台江店）,台江区,大利嘉/汽车南站,3.9,单人善美美容套餐,58,58
纤纤秀经络瘦身,台江区,国货路/群升国际,3.8,单人尊宠窈窕变身套餐,48,55
爱美化妆品（中亭店）,台江区,工业路/茶亭,5.0,妆容设计套餐,9.9,50
祥康盲人按摩,台江区,台江区,4.8,单人按摩/足按2选1,45,48
南宫足浴会所,台江区,大利嘉/汽车南站,3.8,精油开背套餐,128,45
舒简城美容（皇家店）,台江区,中亭街,4.5,单人全身舒缓净排,168,45
豪绅温泉汤池,台江区,大利嘉/汽车南站,4.8,单人足按／指压2选1,198,43
花的嫁衣新娘跟妆工作室,台江区,万象城,4.8,单人新娘早妆（到店化妆）,119,42
妙手养生休闲会所,台江区,台江广场/元洪城,3.8,推拿足浴2选1,98,42
欣欣专业瘦身馆,台江区,时代名城/文化宫,5.0,单人精选瘦腿套餐,28.8,41
清秀佳人美容美体会馆,台江区,中亭街,4.1,单人汗蒸,9.9,39
众福盐蒸美容养生会所（海润滨江店）,台江区,台江万达,4.4,单人精油开背＋定罐＋艾灸,68,37
滴水缘养身会所,台江区,宝龙城市广场,5.0,单人精油开背,88,33
瑶芳祛痘（元洪城店）,台江区,台江广场/元洪城,4.5,单人深层祛黑头套餐,28,32
德善源,台江区,万象城,5.0,单人全脊椎调理,108,31
花颜工作室,台江区,苏宁广场,5.0,嘿脸娃娃美白嫩肤套餐（60分钟）,198,29
研多萃皮肤管理中心,台江区,大利嘉/汽车南站,5.0,皮肤管理超值5项体验卡,98,25
康佳来养生馆（武夷绿洲店）,台江区,台江万达,4.8,单人拔罐,30,22
唯曼尼瘦身塑型体验馆,台江区,宝龙城市广场,4.2,单人拔罐,15.8,21
丹娇美颜坊,台江区,帮洲新区/三保园,4.1,单人面部清洁+水疗,8.8,21
星辰名妆美女加工厂,台江区,大利嘉/汽车南站,5.0,单人星辰名妆面部sa p,68,20
纤寻瘦身美容会所,台江区,中亭街,5.0,眉形设计抵用券,28,18
仨人行美容养生会所,台江区,宝龙城市广场,3.7,单人艾灸/拔罐2选1体验1次,9.9,18
LE CYGNE天鹅童话（台江店）,台江区,台江万达,4.9,面部补水亮肤护理+身体舒缓护理综合精选套餐,128,19
幂2m2韩式高端美甲美睫半永久,台江区,台江万达,4.3,单人芊指嫩白手部护理,9.9,17
舒妍养生馆,台江区,苏宁广场,4.4,面部水润护理1次+精油开背2次,98,16
大美人美业连锁,台江区,中亭街,5.0,艾灸/刮痧/拔罐3选1,9.9,15
千叶堂祛痘美容,台江区,台江区,4.9,痘肌护理体验1次,38,15
Beautyshop 美丽小铺,台江区,台江万达,4.6,单人面部护理套餐,98,15
唯蜜,台江区,台江万达,4.7,单人魔灸开背+面部深层补水护理套餐,168,13
冻龄美人国际美容中心,台江区,中亭街,4.6,单人专业造型师眉型设计3选1,1,13
艾文美学中心,台江区,工业路/茶亭,4.4,韩式皮肤管理,238,11
美艺美甲,台江区,宝龙城市广场,4.7,单人前臂/小腿部脱·毛2选1,138,11
昕颖美容美甲美睫（海润滨江店）,台江区,台江万达,4.6,汗蒸,8.8,11
珈蔓柏纹眉绣眉发际线培训机构（宝龙店）,台江区,台江区,5.0,美白嫩肤净斑去黑头,398,10
ISHOW爱秀  高级私人形象定制,台江区,苏宁广场,4.3,单人单次水氧活肤、皮肤管理,128,9
悦尚养生公馆,台江区,工业路/茶亭,4.6,悦尚精品养生套餐,238,8
美伦推拿中心,台江区,帮洲新区/三保园,4.1,单人套餐4选1,48,7
方冠杨氏百草养颜堂,台江区,台江万达,4.5,单人拔罐套餐,19.9,7
美博城妙抒纹绣,台江区,台江广场/元洪城,3.5,单人拔罐/艾灸体验1次,28,7
莲悦美容美甲会所,台江区,台江万达,5.0,专业面部美白护理套餐,59,5
鹿过美甲（台江万达店）,台江区,台江万达,5.0,打耳洞,19.9,0
【Fashion Queen】美甲美睫半永久工作室,台江区,万象城,4.2,单人舞台装,168,0
大脚丫足浴,台江区,台江广场/元洪城,3.5,单人茶油开背+拔罐/刮痧（2选1）,60,0
金后美容连锁（江滨店）御颜尚宫,台江区,台江广场/元洪城,3.5,单人皇家香氛护理套餐,158,0
STYLE美甲（福四中店）,台江区,帮洲新区/三保园,4.6,单人蓝宝石嫩肤,388,0
筱玫瑰韩式定妆半永久,台江区,工业路/茶亭,4.6,韩式皮肤管理小气泡,78,0
意流纹绣纹身,台江区,中亭街,3.5,单人2*4厘米图案,99,0
榕树下美容美妆工作室,台江区,台江广场/元洪城,4.3,单人新娘专业跟妆试妆套餐,99,0
艾薇儿工作室（宝龙店）,台江区,宝龙城市广场,4.0,单人化妆一次,29.9,0
金后美容连锁（天华店）御颜尚宫,台江区,台江广场/元洪城,3.5,单人皇家香氛护理套餐,158,0
韩香美甲美睫半永久,台江区,工业路/茶亭,5.0,代金券,10,0
鹿过美甲（元洪城店）,台江区,台江广场/元洪城,5.0,打耳洞,19.9,0
Smile诗奈尔美甲韩式半永久私人定制,台江区,宝龙城市广场,5.0,单人脸部护理套餐,58,0
涵曦瘦身美容体验会所,台江区,台江广场/元洪城,3.5,单人汗蒸套餐,19.9,0
潘多拉美业,台江区,工业路/茶亭,5.0,暖宫保养,168,0
大千休闲会馆,晋安区,五里亭,5.0,单人白场足浴/中式推拿一节（2选1）,118,9357
水颐园养生会所,晋安区,世欧王庄,4.5,单人足浴/推拿2选1,98,7062
康之源养生馆（福新店）,晋安区,福新路,5.0,单人足浴/推拿2选1,130,5875
三都足道,晋安区,福新路,5.0,单人足浴/推拿2选1套餐,118,4657
康丽园高尚休闲会所,晋安区,五里亭,4.2,宫廷足浴/宫廷推拿 2选1,108,4389
鑫泉养生馆,晋安区,省图书馆/温泉路,5.0,足浴推拿2选1,98,4246
SUNNY纹眉绣眉纹绣韩式半永久（世欧王庄店）,晋安区,世欧王庄,5.0,眉眼唇抵用券,29,3456
天星园,晋安区,东区/鼓山,4.0,单人宫廷足浴/养生推拿2选1,108,3255
御尚名仕韩式养生,晋安区,福新路,5.0,单人韩式经典,258,3233
爱丁堡尊贵养生会所（福祥店）,晋安区,紫阳/象园,5.0,单人养生套餐,128,2962
福邑温泉养生馆,晋安区,福新路,5.0,足浴/推拿 二选一,133,2528
三兴风采温泉养生（五四北秀山店）,晋安区,五四北,5.0,单人足浴/推拿2选1套餐（开业钜惠）,118,1909
九九养生（华林路店）,晋安区,华林路/茶园,5.0,单人九九足浴/推拿二选一,169,1269
泰自然（温泉店）,晋安区,省图书馆/温泉路,5.0,单人泰式精油套餐,169,1226
水之梦养生会馆,晋安区,岳峰镇,5.0,单人精油开背1次,138,1139
优颖专业脱毛美容会所（王庄店）,晋安区,世欧王庄,5.0,单人腋下净毛包干套餐,88,770
优颖专业脱毛美容会所（五四北泰禾店）,晋安区,五四北,4.9,单人腋下净毛包干套餐,88,770
怡源轩养生健康保健会所,晋安区,晋安区,5.0,单人韩式养身,218,481
三沐推拿,晋安区,五四北,4.8,推拿套餐,68,464
名尚生活,晋安区,金鸡山公园,5.0,单人名尚足浴／推拿2选1,88,402
汇泽养生会所,晋安区,东二环泰禾广场,5.0,单人足浴/推拿2选1套餐,98,401
可诺丹婷美容院（温泉富贵店）,晋安区,省图书馆/温泉路,3.6,可诺丹婷美颜美体连锁特惠丽人套餐,38,390
可诺丹婷美颜美体（盛天店）,晋安区,东区/鼓山,3.6,可诺丹婷美颜美体连锁特惠丽人套餐,38,390
可诺丹婷美容院（福临店）,晋安区,世欧王庄,3.6,可诺丹婷美颜美体连锁特惠丽人套餐,38,390
可诺丹婷美容院（华林店）,晋安区,华林路/茶园,3.6,可诺丹婷美颜美体连锁特惠丽人套餐,38,390
可诺丹婷美容院（罗马店）,晋安区,华林路/茶园,3.9,可诺丹婷美颜美体连锁特惠丽人套餐,38,390
康生源足按推拿店,晋安区,世欧王庄,5.0,推拿套餐,62,377
伊芙世家尊品时尚spa会所（福新会所）,晋安区,福新路,4.9,单人肽水润面部补水保湿护理套餐1次,258,363
自在轩休闲会所,晋安区,东区/鼓山,5.0,单人轩式推拿,68,357
魅诗嘉丽美容中心,晋安区,东二环泰禾广场,4.0,单人美容套餐,108,349
亲亲冰点皮肤管理中心（世欧王庄店）,晋安区,世欧王庄,5.0,单人腋下脱·毛/唇部脱·毛2选1,39,346
爱儿乐婴幼儿spa水育乐园（五四北稻田店）,晋安区,五四北,5.0,开业体验套餐,39.9,258
泰和养生堂（东二环泰禾店）,晋安区,东二环泰禾广场,5.0,单人中式推拿,79,238
心动力足按推拿,晋安区,福飞路/新店,4.2,单人心动舒缓,238,237
BEAUTY美甲美睫Spa会所,晋安区,东二环泰禾广场,5.0,单人美甲套餐,58,232
7星官邸（王庄店）,晋安区,世欧王庄,5.0,单人足浴套餐,178,227
巴厘岛女子养生会所（文物大楼店）,晋安区,省图书馆/温泉路,3.4,健康美容单人套餐,113,217
巴厘岛女子养生会所（东水店）,晋安区,福新路,3.7,健康美容单人套餐,113,217
泰国轻松公司,晋安区,金鸡山公园,5.0,单人泰国古法按摩70分钟 泰国技师,228,213
白子美容纹绣,晋安区,东二环泰禾广场,5.0,单人背部舒缓+面部护理+五行碧玺罐护理特惠套餐,38,208
汇杰盲人中医推拿足浴（岳前路店）,晋安区,岳峰镇,5.0,单人推拿按摩套餐,44.8,108
秀域科技美容（康城店）,晋安区,福飞路/新店,4.0,高科技生活美容单次体验课程,129,103
乐仙居温泉,晋安区,省图书馆/温泉路,4.2,单人推拿/足浴2选1,138,94
徐妍社中药祛痣祛斑,晋安区,世欧王庄,4.9,单人普通“痣”“雀斑”“扁平疣”（三选一去除套餐）,30,89
零肌龄美容,晋安区,火车站,4.2,美容单人套餐,88,85
零肌龄,晋安区,华林路/茶园,4.0,美容单人套餐,88,85
