商家,区域,商圈,星级,服务,价格,销量
倾颜美肤塑形皮肤管理中心（升龙国际广场店）,二七区,升龙广场,4.6,超微气泡深层清洁+精华导出五步曲,46.9,7
美添美业半永久定妆美甲美睫,二七区,长途客运总站,5.0,单人修眉+眉形设计套餐,1,7
兰斐国际.彩妆美甲工作室,二七区,长城康桥华城,5.0,单人眉形设计＋修眉,5,7
Dilei善美韩式半永久纹绣中心（银基王朝分店）,二七区,大商金博大,4.5,单人德国等离子祛全脸痣套餐,19.9,7
丽珍国际医美体验馆,二七区,大商金博大,4.8,单人高端韩式魅力眼线,198,7
臣熙中韩cence半永久定妆,二七区,二七万达,4.2,单人唇部腋下/大小臂/大腿/小腿/比基尼7选1毛发去除套餐,19.9,5
蝶妆· show魅力工作坊,二七区,火车站/二七广场,4.0,单人柔美水貂毛睫毛嫁接,88,5
微魅美甲半永久,二七区,二七万达,5.0,单人德国进口美痣套餐,8.8,5
艾美养生会所,二七区,帝湖,3.5,单人超值拔罐,1,5
糖果养生会所,二七区,长江路中沿线,4.6,单人古典泰式按摩,198,5
铛铛の美甲店,二七区,升龙广场,4.0,单人韩国进口点·痣,8.8,4
古芳中药热敷瘦身塑形馆,二七区,长途客运总站,5.0,单人拔罐套餐,9.9,4
徐大夫小儿推拿,二七区,郑州大学,4.4,单人小儿推拿体验套餐,18.8,4
纯至美皮肤管理中心[韩方科颜】,二七区,升龙广场,5.0,单人全身芳香指压,68,4
锦绣太极足道,二七区,马寨镇,4.9,单人太极中式推拿套餐,108,4
绣艺美容养生会所,二七区,二七万达,4.4,单人四川耳烛,25,4
S-SkinCare 韩国皮肤管理中心（과학 기술 피부 관리）（二七万达）,二七区,二七万达,5.0,单人整身减重3次体验,58,4
dream²美颜●私人定制（万象城店）,二七区,万象城,4.9,皮肤管理团单-小气泡清洁,58,4
羊咩咩美甲专业皮肤管理,二七区,升龙广场,5.0,单人鼻部黑头清理毛孔护理套餐,49,4
艾草香艾灸馆,二七区,郑铁体育中心,4.6,单人刮痧套餐,9.9,3
碧玉足浴养生会所,二七区,火车站/二七广场,3.5,碧玉尊贵,178,3
郑州华美皮肤管理中心,二七区,长城康桥华城,3.5,【特价项目】发际线包脱,388,3
万嘉美甲,二七区,长城康桥华城,5.0,单人手部SPA套餐,49,2
家富富侨（天地惠城店）,二七区,橄榄城,4.5,单人泰式养生,90,2
完颜高端纹绣美甲美睫工作室,二七区,升龙广场,5.0,单人深层清洁补水套餐,19.8,2
韩式生态养颜坊,二七区,长江路中沿线,4.9,单人芦荟鲜汁水疗护肤套餐,9.9,2
萱姿生活馆,二七区,二七万达,4.0,单人面部刮痧套餐,29.9,2
Flower Skin 花溪 皮肤健康管理,二七区,升龙广场,4.9,单人面部深层清洁套餐,88,2
汇美美甲美睫纹绣美容,二七区,长城康桥华城,4.4,养生拔罐/刮痧,8.8,2
艾尚美美甲美睫,二七区,长江路中沿线,3.5,单人毛发去除套餐（6选2）,2,1
体妍美瘦身美容连锁机构,二七区,二七万达,4.3,米肉瘦(月减15～30斤）,19.9,1
z.s美甲纹绣工作室,二七区,橄榄城,5.0,夏日清新5CM&5CM清新小彩绘,88,1
白小纯韩式半永久,二七区,升龙广场,4.0,单人双小臂／双小腿OPT无痛毛发去除2选1,88,1
吉非美甲美睫（永恒理想城店）,二七区,长途客运总站,4.6,单人韩式美睫眼线套餐,498,0
润妍美容瘦身馆,二七区,大商金博大,4.4,单人韩式高端定制眉套餐（开业钜惠多种眉毛款式可选）,498,0
美乐琉璃养生SPA（大商至尊店）,二七区,大商金博大,3.5,魔法师筋膜养护【3次】,128,0
梵医馆（升龙广场店）,二七区,升龙广场,4.0,单人皇家秘笈油疗套餐,129,0
365经筋养生坊（升龙国际店）,二七区,升龙广场,3.5,单人面部提升刮痧,28,0
新美瘦身养生馆,二七区,二七万达,3.5,护理套餐,19,0
珀莱雅（华联商厦店）,二七区,北京华联,3.5,水漾肌密净透洁面露1支,56,0
潘多拉美容美体养生会所,二七区,二七区,4.7,亮睫线,280,0
塑颜女子养生会所,二七区,马寨镇,4.2,单人高品质全身调理套餐一次,48,0
美姿源减肥瘦身招商中心,二七区,橄榄城,3.5,单人瘦身套餐,398,0
诗宇美甲美睫纹绣,二七区,二七万达,4.6,单人拔罐\刮痧2选1套餐,28.8,0
伊美美甲纹绣工作室（伊美私人订制）,二七区,升龙广场,4.6,单人韩式纯植物美睫线套餐,399,0
雅致轩国际护肤机构（二七万达店）,二七区,二七万达,4.5,单人御瑶泡浴+全身疏通套餐,99,0
丽韩国际微雕纹绣连锁机构（二七万达店）,二七区,二七万达,4.0,高端水光套餐,98,0
奈尔韩式半永久纹绣美甲美睫,二七区,升龙广场,4.5,单人韩式零结痂不结痂轻氧眉/流星眉1次,899,0
Angela Face韩式半永久皮肤管理中心,二七区,二七万达,4.1,精品单人半永·久美·瞳线,550,0
叶小姐の店（叶小姐的店）,二七区,二七万达,4.8,单人美·瞳线/眼睫线/美睫线/内眼线/纹·眉/绣·眉套餐,398,0
千色美甲美睫纹绣会馆,二七区,火车站/二七广场,5.0,单人韩式美瞳亮眼线,498,0
晓晓美甲美睫,二七区,鑫苑鑫都汇,5.0,单人双腋下/双小腿/双臂3选1毛发去除套餐,198,0
伊丽莎白纤体养生会所,二七区,升龙广场,4.6,单人艾灸养生套餐,19.8,0
小鬼国际美甲美睫纹绣半永久眉眼（华联商厦店）,二七区,二七区,4.9,单人高端0结痂一次上色美瞳眼线,99,0
纤指绕美甲,二七区,火车站/二七广场,4.5,单人脸部三层清洁,68,0
魔幻仙指足浴养生会所（航海广场店）,管城回族区,福都生活广场,5.0,单人经典御足1次,89,3788
欣奕除疤（城东路店）,管城回族区,福都生活广场,4.8,去黑头：深层清洁+除粉刺+收缩毛孔+补水保湿,58,3110
欣奕除疤（西大街店）,管城回族区,人民路百盛,5.0,去黑头：深层清洁+除粉刺+收缩毛孔+补水保湿,58,3110
欣奕除疤（航海路店）,管城回族区,管城回族区,4.2,去黑头：深层清洁+除粉刺+收缩毛孔+补水保湿,58,3110
克丽缇娜（东风南路店）,管城回族区,郑州东站,4.1,克丽缇娜水妍润泽单人焕美套餐,158,3092
重庆阳光富侨足浴,管城回族区,新世界百货,5.0,中式足浴,98,1980
风牌扬州修脚（紫荆山店）,管城回族区,康桥商务广场,4.3,单人修脚1次,19.9,1970
富侨足道（重庆富侨二七乐居店）,管城回族区,人民路百盛,5.0,单人高级足浴,148,1740
精益源专业盲人按摩,管城回族区,经开区,5.0,单人局部按摩,34.9,1697
大师兄按摩（富田太阳城店）,管城回族区,富田太阳城,5.0,单人全身推拿套餐,68,1549
聚美专业脱毛连锁机构（新世界百货店）,管城回族区,新世界百货,5.0,双腋下蓝宝石冰点无痛脱毛无限次+赠上唇部体验一次,58,1285
重庆富侨（启航大厦店）,管城回族区,福都生活广场,5.0,单人草本 足浴,110,1282
御指天娇中国17店（东区商都店）,管城回族区,郑州东站,5.0,精品足浴,108,1265
道尔康足浴养生会所,管城回族区,富田太阳城,5.0,养元健足,149,1156
舒康中医推拿（经开区店）,管城回族区,经开区,5.0,单人30分钟按摩,34.9,1137
彭世修脚（列里路店）,管城回族区,郑州东站,5.0,单人彭世精品修脚,43,1078
彭世修脚（东方鼎盛时代店）,管城回族区,郑州东站,5.0,单人彭世精品修脚,43,1078
聚源金足足浴养生会所,管城回族区,经开区,5.0,单人商务足浴,109,1079
秀雅阁兰足浴养生会所,管城回族区,富田太阳城,5.0,心满意足,128,982
卢浮公馆颈肩腰腿疼痛康复中心,管城回族区,郑州东站,5.0,单人颈椎调理套餐2选1,45,964
重庆富侨第三大街旗舰店,管城回族区,经开区,5.0,单人尊享足浴,158,964
立美美容瘦身馆,管城回族区,新世界百货,5.0,单人拔罐+刮痧2次,17.9,957
泰圣荷泰国草本美胸国际连锁机构（大上海城店）,管城回族区,大上海城,4.1,【轻度】胸部疏通缓解胀痛3次体验套餐,98,936
卢浮宫1号会所,管城回族区,郑州东站,5.0,单人中式全身按摩套餐,239,935
永康脊柱推拿（康平路店）,管城回族区,郑州东站,5.0,单人颈肩部推拿按摩套餐,42,838
涵羽美容美发（紫荆山店）,管城回族区,新世界百货,5.0,单人芳香经络调理,29.8,759
元桥SPA休闲养生会所（商都路店）,管城回族区,郑州东站,5.0,单人精品足疗,138,741
苗颜坊专业祛痘（郑州经开区理想城店）,管城回族区,经开区,5.0,单人面部补水+清理护理2次,29.9,728
天行健足浴会所（航海路店）,管城回族区,经开区,3.5,单人古典泰式套餐,199,570
益康经络推拿,管城回族区,郑州东站,4.3,单人颈肩或腰部推拿1次,39.8,558
乾元足道,管城回族区,美景鸿城,5.0,乾元单人特色足浴,88,520
阿蒙足浴会所,管城回族区,五洲公园,3.7,足浴套餐,88,478
kiss温水鱼疗休闲健康会所（富田太阳城）,管城回族区,富田太阳城,5.0,单人超值体验套餐,9.9,433
绿野仙踪,管城回族区,美景鸿城,4.7,单人经络养生,199,422
龙光足浴,管城回族区,福都生活广场,5.0,单人精品足浴,129,406
聚元阁养生会所,管城回族区,康桥商务广场,5.0,单人足浴套餐,109,400
童颜阁（富田太阳城总店）,管城回族区,富田太阳城,4.6,单人芦荟鲜汁补水面膜,19.8,382
润源堂盲人按摩,管城回族区,郑州东站,5.0,单人全身推拿1次,70,382
香薇妮丝女子减肥院（列里路店）,管城回族区,郑州东站,4.9,单人十四经络御养全身经络净排养生体验套餐,88,353
荷花池足浴养生会馆,管城回族区,管城回族区,4.8,荷花足浴,129,342
颈肩腰腿疼康复院,管城回族区,郑州东站,5.0,单人拔罐刮痧套餐1次,30,306
重庆富侨（城东店）,管城回族区,紫荆山公园,5.0,单人泰式保健,198,306
荷为美推拿按摩院（永平路店）,管城回族区,五洲公园,5.0,单人中式推拿,41.9,304
水元足浴会所,管城回族区,经开区,5.0,太极足沐,109,302
苗医生专业祛痘（鸿城光彩店）,管城回族区,人民路百盛,5.0,单人专业祛黑头清洁套餐,9.9,298
铭港奕娜美甲美睫美容会所（新世界百货店）,管城回族区,新世界百货,5.0,单人背部刮痧+拔罐套餐,19.9,299
李双双美容芳香SPA（康平路店）,管城回族区,郑州东站,4.1,单人莱佳蔓娇颜面护+宜媛堂背部通经+宜媛堂瑶浴,98,288
李双双美容芳香SPA（云鹤路店）,管城回族区,富田太阳城,3.7,单人莱佳蔓娇颜面护+宜媛堂背部通经+宜媛堂瑶浴,98,288
重庆富侨足浴养生（百盛店）,管城回族区,人民路百盛,5.0,富侨足浴（单人）,108,280
蔚之盈韩式皮肤管理&身材塑造中心,管城回族区,郑州东站,5.0,单人韩国小气泡清洁＋再生光皮肤管理套餐,88,266
蔚之盈皮肤管理&身材塑造中心（郑东002店）,管城回族区,郑州东站,4.9,单人韩国小气泡清洁＋再生光皮肤管理套餐,88,266
舒康李主任经穴疗法,管城回族区,管城回族区,4.3,单人局部按摩,35,254
百年吴越专业祛痘连锁（郑汴路店）,管城回族区,康桥商务广场,5.0,单人专业祛痘体验2次,29,253
爱婴海儿童水浴spa,管城回族区,管城回族区,4.6,单人单次全套体验套餐,42.9,243
鱼医生鱼疗养生馆,管城回族区,经开区,4.5,单人鱼疗,5.9,228
涵曦瘦身理疗馆（福都百货店）,管城回族区,福都生活广场,5.0,单人肩颈护理＋单人背部经络疏通+刮痧/拔罐＋艾灸,68,218
涵曦美肤瘦身体验馆（紫荆山店）,管城回族区,新世界百货,4.7,单人肩颈护理＋单人背部经络疏通+刮痧/拔罐＋艾灸,68,218
康源推拿堂,管城回族区,橡树玫瑰城,5.0,单人推拿,45,214
重庆富侨（东明路店）,管城回族区,康桥商务广场,5.0,单人中华养生套餐,289,202
木子专业脱毛连锁机构（大上海店）,管城回族区,大上海城,5.0,单人无限次双腋下/上唇二选一,88,196
丽人阁,管城回族区,新世界百货,5.0,单人精油开背+经络疏通+刮痧+拔罐套餐,88,195
玉颜阁美容养生馆,管城回族区,富田太阳城,4.8,玉颜阁美容B套餐,19.8,194
未来城推拿,管城回族区,康桥商务广场,5.0,单人推拿+正骨+拔罐套餐,40,183
崔氏推拿正骨,管城回族区,管城回族区,5.0,单人局部推拿,32.9,180
婵媛国际SPA养生会所,管城回族区,富田太阳城,4.3,面部护理套餐,38,170
婵媛国际SPA养生会所,管城回族区,美景鸿城,3.8,面部护理套餐,38,170
婵媛国际SPA养生会所,管城回族区,橡树玫瑰城,3.9,面部护理套餐,38,170
见云美容美体连锁机构（东瑞园店）,管城回族区,郑州东站,5.0,美丽套餐双次5大项目 美丽新启程（仅限商家新客）,98,169
景之韵足道,管城回族区,郑州东站,5.0,单人全身按摩推油套餐,325,164
新概念脊柱推拿（二里岗店）,管城回族区,福都生活广场,4.6,单人按摩,43.8,160
医美怡园专业科技美容连锁（紫荆山店）,管城回族区,管城回族区,5.0,单人一次净肤,10,161
东方楚艾艾灸馆,管城回族区,新世界百货,5.0,单人颈肩／腰部／关节／老寒腿／失眠／扶阳艾灸调理,66,156
红颜魅惑spa养生会所,管城回族区,郑州东站,5.0,单人按摩养生套餐,198,146
阿是足道,管城回族区,郑州东站,5.0,单人御足高级套餐,99,140
净延堂美容养生馆（芦刑庄花苑店）,管城回族区,福都生活广场,4.6,单人养颜汗蒸套餐,9.9,140
易馆经络推拿（富田太阳城店）,管城回族区,富田太阳城,4.8,单人拔罐,18,136
金玉轩休闲养生馆（航海路店）,管城回族区,福都生活广场,5.0,单人推拿按摩套餐,188,133
王者之风SPA养生商务会所,管城回族区,管城回族区,4.5,单人泰式spa套餐,189,131
五谷杂粮果蔬面膜（橡树玫瑰城）,管城回族区,橡树玫瑰城,4.4,单人芦荟鲜汁补水面部护理,19.9,132
熙美半永久定妆,管城回族区,新世界百货,5.0,单人眉形设计+修眉套餐,1,127
杏林盲人保健按摩,管城回族区,康桥商务广场,5.0,颈腰按摩,29,126
艺颜美容瘦身会所,管城回族区,富田太阳城,5.0,单人瘦身高端体验,8.88,121
俏女人美容工作室（富田太阳城店）,管城回族区,富田太阳城,5.0,单人芦荟灌肤+按摩+面膜,9.9,120
kiss温水鱼疗休闲养生馆,管城回族区,新世界百货,5.0,精品双人超值鱼疗套餐,88.8,115
木子美容SPA,管城回族区,福都生活广场,4.2,单人背部刮痧+拔罐套餐,19.9,113
魔瘦专业养生减肥馆,管城回族区,富田太阳城,4.7,单人汗蒸套餐,9.9,112
宁宁塑身坊（正商蓝钻店）,管城回族区,福都生活广场,5.0,单人经络罐,1,104
百艾堂专业艾灸拔罐理疗,管城回族区,福都生活广场,5.0,古法艾灸,39,103
秀域科技美容（玫瑰城店）,管城回族区,橡树玫瑰城,4.0,高科技生活美容单次体验课程,129,104
秀域科技美容（未来店）,管城回族区,富田太阳城,4.3,高科技生活美容单次体验课程,129,104
汇康中医推拿,管城回族区,美景鸿城,4.7,代金券,0.1,100
宣丽滋美容美体连锁机构（远大理想城店）,管城回族区,经开区,5.0,单人精油开背+经络疏通+拔罐+刮痧,78,99
减肥塑型终点站（富田太阳城）,管城回族区,富田太阳城,5.0,单人面部护理/青春定格套餐,59.9,96
小敏美甲,管城回族区,康桥商务广场,4.9,小敏超自然嫁接睫毛套餐,58,95
美尚养生馆,管城回族区,新世界百货,3.8,刮痧拔罐体验套餐,18.8,91
重庆郭氏富侨,管城回族区,郑州东站,4.1,单人中华养生套餐,278,91
减肥美容终点站（鑫苑鑫城店）,管城回族区,郑州东站,4.8,单人魔鬼瘦身减重套餐,28,89
肤韵. 美肤养生会馆,管城回族区,新世界百货,5.0,单人肩颈护理+开背疏通+经络刷背(刮痧)+拔罐套餐,80,91
三和养生会馆,管城回族区,富田太阳城,5.0,单人拔罐/刮痧,15,88
美琪美容美发,管城回族区,橡树玫瑰城,5.0,单人刮痧拔罐套餐,26.8,88
专业人推拿中心,管城回族区,紫荆山公园,4.2,专业人推拿中心全身按摩+刮痧+拔罐,110,87
姿韵瘦身（大上海店）,管城回族区,大上海城,4.6,单人单部位OPT冰点温和毛发去除,1,87
金轩足道,管城回族区,郑州东站,5.0,单人中华spa养生套餐,288,86
ViloKi皮肤管理中心（升龙广场店）,管城回族区,郑州东站,4.9,单人韩国小气泡清洁皮肤管理,138,86
韩妆半永久皮肤管理中心（新世界百货店）,管城回族区,新世界百货,5.0,【韩妆高端皮肤管理中心】单人面部深层清洁套餐,129,84
韩国维娜美容养生会所（鑫苑鑫城店）,管城回族区,郑州东站,3.9,韩国维娜美容单次体验套餐,39.9,84
曼时光减肥美容养生会所,管城回族区,美景鸿城,5.0,单人芦荟鲜汁补水护理,9.9,85
欢子美甲,管城回族区,大上海城,4.9,单人眉形设计＋精修眉毛套餐,1,84
欢子美甲（二店）,管城回族区,大上海城,5.0,单人眉形设计＋精修眉毛套餐,1,84
妃瘦减肥终点站,管城回族区,管城回族区,5.0,单人魔鬼瘦身减重,28,78
施得科技美容连锁机构（紫荆山店）,管城回族区,新世界百货,5.0,单人美肌婴儿面,99,76
伊人经络瘦身,管城回族区,富田太阳城,5.0,单人拔罐,1,77
周医推拿馆,管城回族区,美景鸿城,4.7,单人推拿套餐,49.9,76
施得科技美容连锁机构（富田太阳城店）,管城回族区,富田太阳城,5.0,单人美肌婴儿面,99,76
JP·Salon,管城回族区,管城回族区,5.0,单人芦荟鲜汁面膜体验,29.9,76
侨杞足浴,管城回族区,南三环汽配大世界,3.9,草本足浴,159,73
刘氏修脚,管城回族区,新世界百货,5.0,单人经典足浴套餐,59.9,71
We Like半永久童颜私人订制,管城回族区,富田太阳城,5.0,单人刮痧拔罐套餐,9.9,69
毛氏祖传推拿,管城回族区,经开区,4.0,单人局部推拿+刮痧+拔罐套餐,72.6,67
金子足道,管城回族区,福都生活广场,3.7,超值套餐,68,66
本草秀复专业除疤祛痘连锁机构,管城回族区,橡树玫瑰城,5.0,单人 草本秀复 祛黑头护理5次,88,66
福寿堂专业盲人按摩,管城回族区,经开区,5.0,局部（颈肩腰头）按摩,25,64
沐木日式美甲美睫纹绣（大上海城店）,管城回族区,大上海城,5.0,单人高级定制设计精致修眉,1,63
艾美专业瘦身（康桥花园店）,管城回族区,康桥商务广场,4.9,单人热敷瘦身体验1次,1,63
瘦丽国际养生减肥店（美景鸿城店）,管城回族区,美景鸿城,5.0,单人精油开背+拔罐+刮痧,39.9,62
臻致美肌皮肤管理中心（新世界百货总店）,管城回族区,新世界百货,5.0,单人韩国小气泡清洁套餐,88,63
玥玥美容,管城回族区,福都生活广场,4.2,单人开背刮痧拔罐套餐,29.8,59
虞美人养生会所,管城回族区,富田太阳城,5.0,单人经络疏通肩颈／背部／腰部／头部／腿部5选2,15.9,60
美容减肥spa会所,管城回族区,紫荆山公园,5.0,单人精油开背+经络疏通+刮痧+拔罐套餐,38,58
推贝贝小儿推拿,管城回族区,福都生活广场,5.0,单人小儿推拿体验套餐,19,58
鲜灸堂盲人推拿养生馆,管城回族区,郑州东站,5.0,单人中式全身推拿,58.8,58
苗系芳颜专业（富田太阳城）,管城回族区,富田太阳城,4.3,毛孔清理套餐,28,56
New Face皮肤健康管理中心（郑州总店）,管城回族区,郑州东站,5.0,小气泡深层清洁+ 韩国再生光皮肤管理,98,51
速美专业减肥塑型工作室（银基商贸城店）,管城回族区,管城回族区,5.0,单人背部（精油）经络疏通,25,49
吸引力美肤造型spa会所,管城回族区,经开区,3.5,洗剪吹,23.8,47
健体艾灸推拿理疗室,管城回族区,美景鸿城,5.0,穴位拔罐+经络刮痧,38.8,46
阿炳健体（福禄街店）,管城回族区,郑州东站,4.3,单人按摩（半小时）,40,36
静姿（国际）美容养生SPA会所,管城回族区,福都生活广场,4.2,静资国际精选套餐,39,34
牵正推拿,管城回族区,经开区,3.9,单人刮痧/拔罐2选1,15,33
芙蒂娜.私人美丽定制（鑫苑世纪东城店）,管城回族区,郑州东站,4.5,单人养生艾灸 单次,29.9,32
晋美SPA生活馆,管城回族区,郑州东站,5.0,单人拔罐/刮痧套餐,38,32
聂氏正脊推拿中心,管城回族区,郑州东站,4.3,单人拔罐,20,31
伊芙妍美容会所,管城回族区,康桥商务广场,4.6,单人韩国深层水氧护理眼部BIO淋巴调理,48,29
荟草堂专业祛痘中心（新世界百货店）,管城回族区,新世界百货,5.0,单人深层补水护理套餐,38,28
妩媚足浴养生会馆,管城回族区,经开区,5.0,单人中华养生按摩套餐,298,28
塑美私人定制,管城回族区,新世界百货,4.9,单人塑美私人定制发际线或腋下或比基尼,88,28
美塑空间韩式半永久,管城回族区,富田太阳城,5.0,单人艾灸／刮痧／拔罐／背部疏通（三选一）,9.9,27
尊懿国际美学纹绣培训,管城回族区,富田太阳城,5.0,单人拔罐/刮痧/肩颈三选一套餐,9.9,27
豪爵国际SPA养生会所,管城回族区,郑州东站,5.0,单人豪爵精致spa,198,26
甲冉生修脚会所,管城回族区,富田太阳城,5.0,单人修脚套餐,28,25
财信圣堤亚纳spa养生,管城回族区,郑州东站,4.1,单人Spa套餐,299,24
皇家SPA脊椎养生会所,管城回族区,福都生活广场,3.9,单人脊椎保养,28,24
仲夏夜之梦男子spa养生会馆,管城回族区,福都生活广场,4.6,娇口之哨spa保健养生,399,25
遇植茵专业祛斑祛痘,管城回族区,管城回族区,5.0,芦荟鲜汁灌肤,9.9,26
娇子美容SPA养生会所（南三环店）,管城回族区,美景鸿城,4.4,单人肩部/肠胃/卵巢/胸部4选1套餐,18,24
Dora科技抗衰美容中心,管城回族区,郑州东站,4.6,Dora黑头清洁皮肤、美白补水嫩肤,8.8,23
萝兰主题养生馆,管城回族区,经开区,4.3,单人护理套餐,9.9,24
泡芙小姐减肥终点站,管城回族区,经开区,5.0,单人腹部疏通,68,23
嘉柏俪香薰精油护肤连锁机构（富田店）,管城回族区,富田太阳城,4.1,美容护肤,9.8,23
丽湾SPA养生会所（高铁站店）,管城回族区,郑州东站,5.0,单人养生套餐,288,22
陈氏推拿（货站北街店）,管城回族区,康桥商务广场,4.6,单人颈肩调理,28.9,21
美颜韩式皮肤管理,管城回族区,郑州东站,5.0,单人冰点无痛毛发去除,19.9,21
莎莎SPA--丸美美容养生会所,管城回族区,富田太阳城,4.5,单人面部水动力滋养护理套餐,29.9,20
道荷古方瘦身spa会所,管城回族区,福都生活广场,4.9,单人面部水疗B套餐,9.9,20
艾康艾灸美容会所,管城回族区,紫荆山公园,5.0,单人拔罐刮痧二选一,9.9,20
清秀佳人美容养生会所,管城回族区,郑州东站,4.6,单人高端背部经络疏通+拔罐+刮痧套餐,48,21
田野Field（大上海城店）,管城回族区,大上海城,5.0,德国OPT蓝宝石冰点脱毛（腋下/唇部）,9.6,20
西唐推拿馆（货东社区店）,管城回族区,管城回族区,5.0,特价推拿30分钟,29.9,20
远大spa养生公馆,管城回族区,经开区,5.0,单人推拿男爵广莞SPA养生套餐,388,20
艾美女士美容,管城回族区,郑州东站,4.3,单人奢华套餐身体护理,39.9,18
贺贺spa美容美体（美景鸿城店）,管城回族区,美景鸿城,4.6,48元美容养生套餐,48,18
王氏推拿堂,管城回族区,福都生活广场,4.0,草本足疗,60,18
付氏推拿堂,管城回族区,康桥商务广场,4.0,草本足疗,60,18
东方美莱医美美容院,管城回族区,福都生活广场,4.9,OPT冰点无痛腋下或唇部脱毛,99,15
Angel face美容会所,管城回族区,管城回族区,4.5,单人高端海藻色料美瞳线一次,168,15
雪莲丽人秀,管城回族区,康桥商务广场,4.2,单人拔罐,9.9,15
旱极沙灸国际养生会所（河南总店）,管城回族区,郑州东站,4.9,单人沙灸SPA,35,15
仁手中医拍打按摩,管城回族区,郑州东站,4.9,单人颈肩背深度疏松套餐,98,15
薇薇美甲美睫护肤沙龙,管城回族区,富田太阳城,5.0,单人【面部深层补水】-面部清洁＋经络按摩＋深层补水,22,15
梓源逆龄皮肤管理中心（紫荆山店）,管城回族区,紫荆山公园,3.5,单人水氧焕颜美肤（小气泡升级版）,80,14
MAY科學顏究院,管城回族区,新世界百货,4.9,单人冰点无痛唇部/腋下脱毛疗程（5次）,98,14
爱儒雅美容养生连锁机构,管城回族区,橡树玫瑰城,4.7,大礼包套餐,88,14
纤雅美容养生会所,管城回族区,新世界百货,4.8,单人肩颈舒缓+芳香开背,68.8,13
烟雨阁男子spa养生会馆（美景鸿城店）,管城回族区,美景鸿城,4.9,尊享舒压精油spa养生套餐,288,13
臻美名妆（福都广场店）,管城回族区,管城回族区,4.4,臻美名妆刮痧拔罐,19.9,13
ONE BEAUTY美甲美睫化妆培训（东大街店）,管城回族区,新世界百货,5.0,单人黑钻面部深层清洁（特惠体验）,99,13
艺瘦热敷瘦身塑形馆（航海路店）,管城回族区,福都生活广场,5.0,单人咖啡灌汤净排养生套餐,29.8,13
郑州天后TinHoo美容中心（黄河南路店）,管城回族区,郑州东站,5.0,韩国氧气泡泡套餐/4次,76,14
海丽健康养生会所（紫荆山金城国贸店）,管城回族区,管城回族区,4.5,单人草本泥灸套餐,19.9,12
s纤体瘦身会所,管城回族区,新世界百货,4.6,单人五行经络罐一次套餐,1,12
恰美容妆,管城回族区,康桥商务广场,5.0,单人化妆,19.8,12
美丽邂逅养生馆,管城回族区,康桥商务广场,4.6,单人经典养生套餐,198,11
